skillid,skillname,category,reviewer,star,title,date,content
B0746DVDH2,Blue Sky,Social,Mark,1.0 out of 5 stars,Do not click.  There isn't a disable button,"Reviewed in the United States on December 18, 2018",This doesn't have a disable button.  That is troubling.  It doesn't seem to do anything and it seems to not show up on the phone.  Odd to have it.  I thought it was BigSky and made the same mistake others make.  Hope it isn't a phishing scam.
B0746DVDH2,Blue Sky,Social,Kenya,1.0 out of 5 stars,Why does this even exist???,"Reviewed in the United States on February 20, 2018",I don't understand what the purpose of this is.  This morning I forgot the name of the app that I was trying to get to (Big Sky) and was very confused by this.  Who the heck is Jabel and why would I want to talk to him anyway?!?!?
B0746DVDH2,Blue Sky,Social,Teddy,1.0 out of 5 stars,Who tf is Jabil?,"Reviewed in the United States on January 5, 2021",Who the Eff is Jabil? This app is stupid. Im not telling a disembodied voice with a stupid name that I love or hate it. I just wanted the weather report. Whoever did this is touched in the head.
B0746DVDH2,Blue Sky,Social,TeamCanote,1.0 out of 5 stars,Dirty trick,"Reviewed in the United States on March 19, 2018",Pretty sure this skill is here only to confuse/take advantage of those who are mistakenly trying to use the Bigsky skill and accidentally say blue sky.
B0746DVDH2,Blue Sky,Social,drjackk,1.0 out of 5 stars,Useless,"Reviewed in the United States on June 28, 2020",Not sure how this skill got enabled.It does nothing obvious.Confused it with the Big Sky Weather skill.
B0746DVDH2,Blue Sky,Social,Adam T,1.0 out of 5 stars,The first Alexa virus? Lovely...,"Reviewed in the United States on June 19, 2020","You knew it had to happen sooner or later... an Alexa virus. Next, be on the lookout for phishing apps that have names that sound the same as legit apps but ask for personal information, passwords, etc. Isn't it great to live in a world where you can't trust anything because of scumbags like tthis?Even more suspiciously though, at the time of this writing (June 2020), the skill page claims that 49% of the reviews are 5 stars for this app. But when you click on ""5 stars"" to see those reviews, no results are returned. Manually reviewing all posted reviews shows that every last one of them is 1 star. What's up with that? Does Amazon not want people to see when an app is universally hated? Why not?"
B0746DVDH2,Blue Sky,Social,Bee Herder,1.0 out of 5 stars,Earth to Amazon ... Hello? Are you there?,"Reviewed in the United States on October 19, 2018","This ""app"" is universally rated as useless and an obvious attempt to take advantage of people who are trying to get to Big Sky. Do you care? Can anyone put any app out there, with no control exercised by Amazon? How about making this irritant go away."
B0746DVDH2,Blue Sky,Social,Shawn C. Morris,1.0 out of 5 stars,Gets my vote for most annoying skill,"Reviewed in the United States on December 2, 2018",What is even the point? Even when I definitely say open BIG sky I occasionally get shunted off to this waste. No one wants to talk to Jabel.
B0746DVDH2,Blue Sky,Social,Tech Geek,1.0 out of 5 stars,i never want to see this skill again,"Reviewed in the United States on December 14, 2018",open big sky gives me this crapy app
B0746DVDH2,Blue Sky,Social,Aggie ,1.0 out of 5 stars,please remove this skill its a bad joke,"Reviewed in the United States on February 12, 2020",these skill is a joke and does nothing please remove it
B0746DVDH2,Blue Sky,Social,Nicholas D. Cavis,1.0 out of 5 stars,skill is hacked with a virus : whats me to say :jako i love you,"Reviewed in the United States on September 15, 2020",skill is hacked with a virus : whats me to say :jako i love you
B0746DVDH2,Blue Sky,Social,Amazon Customer,1.0 out of 5 stars,Amazon needs to delete this,"Reviewed in the United States on February 20, 2019","This app has no purpose and only confuses people who try to open ""Big Sky.""  Read the reviews, Amazon, and take this down."
B0746DVDH2,Blue Sky,Social,Waffleiron,1.0 out of 5 stars,joke?,"Reviewed in the United States on July 7, 2020",Yabba dabba doo to you too
B0746DVDH2,Blue Sky,Social,Simon Hernandez,1.0 out of 5 stars,Trash,"Reviewed in the United States on September 29, 2019",Trash app meant to be mixed up with the weather app.
B0746DVDH2,Blue Sky,Social,Amazon Customer,1.0 out of 5 stars,Stupid app.,"Reviewed in the United States on December 15, 2017",The title says it all.  I don’t know why this even exists in the available skills library.
B0746DVDH2,Blue Sky,Social,Cookiekins,1.0 out of 5 stars,What?,"Reviewed in the United States on March 28, 2018",I am one of the fools that mixed this app up with Big Sky. This app is not a weather app. Big Sky is one of the best weather apps I have tried.
B0746DVDH2,Blue Sky,Social,G. Miller,1.0 out of 5 stars,Makes no sense,"Reviewed in the United States on March 30, 2018",Make sure you say bigsky not bluesky! Junk!
B0746DVDH2,Blue Sky,Social,Matt,1.0 out of 5 stars,"This Skill has been HACKER. Amazon, please remove it!","Reviewed in the United States on July 30, 2021",This used to be a weather app. Now it's possibly spyware.
B0746DVDH2,Blue Sky,Social,Harry,1.0 out of 5 stars,this app changed,"Reviewed in the United States on July 1, 2021",Changed from a weather forecast to something weird.
B0746DVDH2,Blue Sky,Social,Saraneth,1.0 out of 5 stars,Highly annoying app,"Reviewed in the United States on November 12, 2018",Like everyone one else here this app was op bee by mistake when I tried to open big sky.
B0746DVDH2,Blue Sky,Social,Ari Faria,1.0 out of 5 stars,did not add skill,"Reviewed in the United States on June 16, 2021",indidnt add the skill so not sure what this is
B0746DVDH2,Blue Sky,Social,E. Sippel,1.0 out of 5 stars,"Ended up with this app when I asked for ""Open BIG sky""","Reviewed in the United States on May 25, 2018","Ended up with this app when I asked for ""Open BIG sky""."
B0746DVDH2,Blue Sky,Social,Gilbert J. Arguelles,1.0 out of 5 stars,Not a weather skill.,"Reviewed in the United States on January 8, 2018",Don't know what it's about.
B0746DVDH2,Blue Sky,Social,Kimber Scott,1.0 out of 5 stars,Hacked,"Reviewed in the United States on June 23, 2021","Asks me to say Jabil I love you, Jabil I miss you, as opposed to the detailed weather report it used to give. Disabled skill."
B0746DVDH2,Blue Sky,Social,TBury,1.0 out of 5 stars,Pointless garbage.,"Reviewed in the United States on May 27, 2018",Useless.
B072MFD1T9,High five,Social,Prateek Bansal,5.0 out of 5 stars,Five Stars,"Reviewed in the United States on August 30, 2017",High Five!!
B07KX4LFCL,Aerohive HiveManager Shortcuts,Social,Knleach1989,5.0 out of 5 stars,TheHive and Alexa!,"Reviewed in the United States on April 4, 2019",Loving this :)
B079VWSZWV,Free Jose,Social,Heath Bohman,5.0 out of 5 stars,Very Cool,"Reviewed in the United States on February 18, 2018",This skill is so cool!
B0721RM18X,Witty Insults,Social,Amazon Customer,2.0 out of 5 stars,Skill needs improvement,"Reviewed in the United States on June 26, 2017",Thought this skill would be funny but it's a hassel to have to say Alexa- ask Witty Insults to insult me. That's the only phrase that works and it only gives one insult.
B0721RM18X,Witty Insults,Social,David512,1.0 out of 5 stars,Only one phrase works,"Reviewed in the United States on July 10, 2017","The first phrase is the only one that picks up, and the insults are kind of childish..."
B01N8R11LZ,Today's statement,Social,D. W. Morgan,4.0 out of 5 stars,Novel Idea...,"Reviewed in the United States on December 15, 2017","I think the developer has a pretty good idea here.  Something to do along with your morning coffee, and for your after dinner drink."
B01N8R11LZ,Today's statement,Social,Alexis Lorraine Lukas,5.0 out of 5 stars,Five Stars,"Reviewed in the United States on February 9, 2017",Great idea and very fun!
B01N8R11LZ,Today's statement,Social,Remon,4.0 out of 5 stars,Everyday a surprise.,"Reviewed in the United States on December 17, 2016",Fun!
B07Q6NYLJZ,My Skeleton,Social,Brandon,5.0 out of 5 stars,amazing,"Reviewed in the United States on March 31, 2019",you can say hello each other
B07NW78X4H,OnLine with Bill Alexander,Social,Nuttall,5.0 out of 5 stars,Love the show!,"Reviewed in the United States on February 25, 2019",Love the show!  Bill is a true radio professional.
B07PGN7SP2,Buzz Burbank News  Comment,Social,PatsFan,5.0 out of 5 stars,Great news source,"Reviewed in the United States on May 31, 2019","The Best! This guy reminds me of Paul Harvey,  Excellent source of news!"
B07FD7X7XZ,What Does Phyllis Have to Say,Social,Dianna Simpson,5.0 out of 5 stars,Love this flash briefing!!!,"Reviewed in the United States on January 11, 2019",Phyllis does such a great job of giving you small manageable chuncks of information that you can easily incorporate into your business. I highly recommend listening to her regularly.
B07JK6KXZ6,What’s Your Story?,Social,Colleen Kochannek,5.0 out of 5 stars,Our Stories Drive Connections,"Reviewed in the United States on November 12, 2018","The ability to connect with people, in an authentic way, is the best way to grow and strengthen relationships with our customers. In this day, where we're bombarded with messages, it's more important than ever to 'connect' with people.April tells us how to formulate our stories in a way that's authentic, in a way that will help us really connect with each other. She teaches us how to re-find stories we may have lost in ourselves, too.April's 'What's Your Story?' Alexa Flash Briefing is a breath of fresh air everyday. I'm listening and learning how to bring my story out into the world so I can connect with my customers in a real, memorable and heartfelt way."
B07JK6KXZ6,What’s Your Story?,Social,J. Jones,2.0 out of 5 stars,Hasn't updated in months,"Reviewed in the United States on March 22, 2021","I really enjoyed this flash briefing, but it hasn't been updated in months. They just keep repeating the same episode. Over and over again. I pretty much have it memorized. Hopefully she'll come back, but for now I'm deleting this because I've given up hope this will return anytime soon."
B07JK6KXZ6,What’s Your Story?,Social,ARKlady,5.0 out of 5 stars,"Useful, Informative & Inspirational","Reviewed in the United States on November 4, 2018","I love a good story with take away lessons and this briefing delivers both. One of my favorites, April shares personal stories as well as those shared with her by others. Useful, informative and inspirational her updates show how stories connect us. Highly recommend."
B07JK6KXZ6,What’s Your Story?,Social,Gizmo Lover,5.0 out of 5 stars,"A reason to say ""Alexa Start My Day""","Reviewed in the United States on January 17, 2019","I am not a woman and I get great ideas and inspiration every morning from April's briefing. She does a really great job of helping me to start my day with a positive point of view. I have me Alexa set up so that when I say ""Alexa Start My Day"" the lights come on, and the Lightbeamer starts my morning!"
B07JK6KXZ6,What’s Your Story?,Social,Arlene Hoffman,5.0 out of 5 stars,LOVE the Lightbeamers Content and April's Master Skills,"Reviewed in the United States on December 30, 2019","I have been listening to April on Alexa for months now, read her practical ebooks and find her approach refreshing and smart. She has helped me to stay focused on my goals, even though I did get off course for a while. By listening to her every day on my Flash Briefing, she has consistently delivered great content in a simple and easy to digest manner. I hope to meet April one day!"
B07JK6KXZ6,What’s Your Story?,Social,Dchoi,5.0 out of 5 stars,Incredible woman and message,"Reviewed in the United States on October 31, 2018","Having worked directly with April, her message is always inspiring and thought provoking and pushes me to dig deep into myself to GROW!"
B07JK6KXZ6,What’s Your Story?,Social,Mindful mya,5.0 out of 5 stars,Thought Provoking and Inspiring,"Reviewed in the United States on March 22, 2019",This is such a great briefing! Today's message was about supporting the messages of others. It also shed light upon the way that members of marginalized groups have consistently experienced having their stories overlooked.  Wow! This was very refreshing to hear and I will be spreading it far and wide.
B07JK6KXZ6,What’s Your Story?,Social,Michelle Winters,5.0 out of 5 stars,"Regularly updated, high-quality content","Reviewed in the United States on December 23, 2018","These flash briefings are always a pleasant surprise and a positive start to the day. If you’re looking to grow as a writer or want to journal regularly, this is a great place to start."
B07JK6KXZ6,What’s Your Story?,Social,Amazon Customer,5.0 out of 5 stars,What Matters Most,"Reviewed in the United States on April 9, 2019","Not only does April have a soothing voice to listen to, but her AB’s are full of thought provoking questions. She’ll help you to see things in a different light, encourage you to share YOUR story with others, and she’ll be your biggest cheerleader!"
B07JK6KXZ6,What’s Your Story?,Social,Andy Rosengard,5.0 out of 5 stars,Excellent overview of storytelling- a must for businesses!,"Reviewed in the United States on November 1, 2018","April breaks down key points on why we need to embrace life's moments and break them down into stories that resonate with potential clients and existing customers. Every entrepreneur and business owner who wants to grow their businesses and nurture relationships will benefit from this strategy. Well-done, April!"
B07JK6KXZ6,What’s Your Story?,Social,Lanette_Pottle,5.0 out of 5 stars,Experience + Heart,"Reviewed in the United States on February 26, 2019","April generously shares her experience, wisdom, and Texas-sized heart to this briefing every day. Beyond her great stories, she brings us encouragement and something juicy we can take action on immediately."
B07JK6KXZ6,What’s Your Story?,Social,PHall,5.0 out of 5 stars,these flash briefings are so helpful!,"Reviewed in the United States on October 31, 2018","These flash briefings are so helpful and informative on how to use story to boost my brand, relate to my customers, and connect my audience my biz. Thanks so much for all the great info.!"
B075F6FWKV,Top Poll,Social,Su Chang,5.0 out of 5 stars,Great Poten,"Reviewed in the United States on November 15, 2017",It would be very interesting to see the public’s opinion on a variety of questions of concern to the community.
B075F6FWKV,Top Poll,Social,Voicebot.ai,5.0 out of 5 stars,This is a great idea to take flash polls of Amazon Echo users,"Reviewed in the United States on November 8, 2017",This is a great idea to take flash polls of Amazon Echo users. I like that it shares results in real-time.
B07KDT1F3W,Translator Bot,Social,nem,1.0 out of 5 stars,did not work for me,"Reviewed in the United States on March 21, 2022","I could not get it to translate!if i could, i would give it 0 stars!"
B07CTWFWBF,Chat Bot,Social,Mike M,1.0 out of 5 stars,Uggga,"Reviewed in the United States on May 23, 2018","All she says is Hello how are .you, and whdn you Say I'm fine she just repeats I I don't undsestand that over and over,  also i think i have lost it cause im talking to a Dot ,,uggg i need a Life"
B07CTWFWBF,Chat Bot,Social,Cheryl  Maurer,1.0 out of 5 stars,ugh!,"Reviewed in the United States on January 6, 2020",She kept saying that she didn't understand me!
B07CTWFWBF,Chat Bot,Social,AustinSun,1.0 out of 5 stars,Nope,"Reviewed in the United States on October 21, 2021",Very annoying.  Not at all entertaining.
B07CTWFWBF,Chat Bot,Social,Douglas Migliaccio,3.0 out of 5 stars,she stops engaging in  the convo before im ready for the app too close,"Reviewed in the United States on November 18, 2018",other than being glitchy i think she is the best social bot mazon has made yet good job now if you could just patch the problem of her shutting down and p.s. i found she not terminate the program she juswt goes quiet if you say clever bot she usually responds
B07CTWFWBF,Chat Bot,Social,Mevline,1.0 out of 5 stars,Not much of a conversation,"Reviewed in the United States on March 6, 2019",she didnt ndestand anthing
B07CTWFWBF,Chat Bot,Social,Judy Mccall,1.0 out of 5 stars,I Think It's Broken,"Reviewed in the United States on November 11, 2018","It's a non-working skill. Just asks me over and over ""hello How Are You?"", but when you say something, it responds that it doesn't understand that. Removing this skill."
B07CTWFWBF,Chat Bot,Social,Nana Saucedo,1.0 out of 5 stars,repetitive,"Reviewed in the United States on January 31, 2021",Does not work
B07CTWFWBF,Chat Bot,Social,Rebecca Sturtevant,1.0 out of 5 stars,Would not turn off.,"Reviewed in the United States on May 10, 2019","This opened randomly, chatted about music for a few minutes, told me about headlines, then asked if I wanted to hear more, I said no, then she continued, I said Alexa turn off, she asked to review it, and I said 1 star, Alexa turn off, she went on trying to explain how to start it up again.  Then I said Alexa TURN OFF!"
B07CTWFWBF,Chat Bot,Social,Special,1.0 out of 5 stars,Does not work,"Reviewed in the United States on January 19, 2019",Repeats i didnt understand that hello how are you.
B07CTWFWBF,Chat Bot,Social,Wanda,1.0 out of 5 stars,"started without asking, no command","Reviewed in the United States on February 3, 2019",started talking without being enabled
B07CTWFWBF,Chat Bot,Social,AS,1.0 out of 5 stars,Doesn't function properly,"Reviewed in the United States on October 17, 2020",Keeps repeating the same thing over and over
B07CTWFWBF,Chat Bot,Social,laressa Manning,1.0 out of 5 stars,will not stop,"Reviewed in the United States on January 25, 2020",terrible
B07CTWFWBF,Chat Bot,Social,Robert,1.0 out of 5 stars,frystrated,"Reviewed in the United States on July 8, 2020",doesnt work
B07CTWFWBF,Chat Bot,Social,Alicia Mclaughlin,3.0 out of 5 stars,chat bot,"Reviewed in the United States on April 4, 2019",i asked alexa about the weather and she thought i wanted  to chat  so i did  i startex to talk to her i thought it was neat bwhaha.
B07CTWFWBF,Chat Bot,Social,Zain,1.0 out of 5 stars,Does not understand u,"Reviewed in the United States on May 7, 2018",It never understand u even if u say it so louldy.If they fix it then it would be good
B07N8T8BYD,The Geek State,Social,Ramon,5.0 out of 5 stars,Easy way to enjoy the podcast!,"Reviewed in the United States on February 5, 2019",🧙🏼‍♂️
B07S59MHQX,My Relay,Social,PrettyGirlData,4.0 out of 5 stars,Helps me in mornings,"Reviewed in the United States on August 25, 2019",We use our Relay Go’s a lot.  they sometimes get misplaced in tge house with rhe kids. this skill helps us find the devices quickly.
B07S59MHQX,My Relay,Social,Chelsey,1.0 out of 5 stars,Useless,"Reviewed in the United States on October 30, 2019",You can broadcast to the device but Alexa is unable to locate the device. Locating a relay is the entire point of the device! This skill is useless if this doesn't work.
B07S59MHQX,My Relay,Social,Irina,1.0 out of 5 stars,needs a lot of work.,"Reviewed in the United States on September 15, 2019",super complicated to use it. ive linked everythung but still cant communicate to my relay.
B07S59MHQX,My Relay,Social,Ryan Connelly,1.0 out of 5 stars,"Buggy, non-functional","Reviewed in the United States on October 25, 2019",This has so much potential to be a great product. Raise more capital and hire more engineers to fix your software. This integration is buggy and really doesnt work.
B07S59MHQX,My Relay,Social,Brent ,1.0 out of 5 stars,outstanding idea!,"Reviewed in the United States on July 25, 2021",needs work. developing this will keep me in the relay world longer!
B07S59MHQX,My Relay,Social,Mat,1.0 out of 5 stars,doesn't work,"Reviewed in the United States on August 30, 2019",alexa doesn't recognize any commands except open my relay. nonop
B07S59MHQX,My Relay,Social,Amazon Customer,1.0 out of 5 stars,Does. Not. Work.,"Reviewed in the United States on September 5, 2019",What’s the purpose of developing and releasing a skill if it’s not going to work?!
B071DFGYRG,ChitChat,Social,Hartwig Household 8,4.0 out of 5 stars,interesting way to kill time,"Reviewed in the United States on April 16, 2020",its like talking to and adding anthropromophotics to help the AI’s learn
B07P7PVV1L,Confess Box,Social,TMore,1.0 out of 5 stars,Couldn’t get past the introductory,"Reviewed in the United States on November 1, 2021",Every time I would try to start I would get a response that would tell me this very same thing as if it was trying to open I never got around to actually train this app because I couldn’t get past the first step which was the introductory.
B074L9KTLB,complaint listener,Social,Francesca,4.0 out of 5 stars,Four Stars,"Reviewed in the United States on December 7, 2017",Fun little skill basically she listens and then tells you to suck it up!
B074L9KTLB,complaint listener,Social,Average Consumer 123,1.0 out of 5 stars,Dumb app,"Reviewed in the United States on January 24, 2018",Dumb
B074L9KTLB,complaint listener,Social,Leomaris,1.0 out of 5 stars,sucks,"Reviewed in the United States on February 22, 2018",this app sucks. it's not a complaint listerner.
B074L9KTLB,complaint listener,Social,Charles A.,3.0 out of 5 stars,Bought Alexa and seemed ok but now it doesn't turn ...,"Reviewed in the United States on June 22, 2018",Bought Alexa and seemed ok but now it doesn't turn off when asked. I have to unplug it. so what's up?
B074L9KTLB,complaint listener,Social,BookishBlonde,5.0 out of 5 stars,Five Stars,"Reviewed in the United States on May 19, 2018","Funny app, good for a laugh!"
B07KRCWDPP,Survey Assistant,Social,John Overholt,5.0 out of 5 stars,How Do I Get My Business Through This Service,"Reviewed in the United States on January 7, 2019","I love the idea of using this software for research, but I don't see where I can contact the developer for its use. Please respond with contact information."
B01N67DA99,Narendra Modi Tweets unofficial,Social,Salil,5.0 out of 5 stars,What a bright idea Sirji!!,"Reviewed in the United States on December 6, 2016",Amazi
B01N67DA99,Narendra Modi Tweets unofficial,Social,Eleanor Shellstrop,1.0 out of 5 stars,Twit from the horse's mouth.,"Reviewed in the United States on December 27, 2016",This is not the way to stay politically informed. Politicians need journalistic filters to keep them accountable for their words.
B01N67DA99,Narendra Modi Tweets unofficial,Social,Gaytri,5.0 out of 5 stars,Wow that's so simple but amazing app!,"Reviewed in the United States on November 28, 2016",Wonderful!
B075X5D9SP,Riley's Codecademy Skill,Social,XXX,1.0 out of 5 stars,Why Riley?,"Reviewed in the United States on September 27, 2017",This is literally the dumbest skill ever.
B075X5D9SP,Riley's Codecademy Skill,Social,Amazon Customer,5.0 out of 5 stars,Best skill,"Reviewed in the United States on February 9, 2018",Im proud of u
B07576N1KL,Fairfax County Library,Social,Wootz,1.0 out of 5 stars,audio books,"Reviewed in the United States on December 15, 2018",i have Hoopla from Prince William library but there is nothing for Fairfax County. where is Libby or Overdrive. live in Lorton so had to cross River for a card
B07NS36WDH,UNSKIPPABLE with Jim Kukral,Social,CK WindyCity,5.0 out of 5 stars,Entertaining and practical podcast,"Reviewed in the United States on June 25, 2019",I enjoy the Unskippable podcasts. Jim Kukral explains how to make your business and life something that gets people's attention--not just another voice in the crowd. Great show!
B01NBJP14J,Husseini Islamic Center,Social,Hibaaq,5.0 out of 5 stars,Awesome app,"Reviewed in the United States on December 30, 2017","Kinda weird and hilarious how some people specifically look up a Muslim app on their Alexa of all things, just to show some hate. I would have never thought of Alexa as a platform for bullying. Wow, super impressed. Lol you guys there's so many self help books out there. You can turn your life around. Never too late. No joke. May you be blessed with wisdom and truth. ❤️"
B01NBJP14J,Husseini Islamic Center,Social,Amin Toussaint,5.0 out of 5 stars,Five Stars,"Reviewed in the United States on December 10, 2017",Just amazing !
B01NBJP14J,Husseini Islamic Center,Social,Matthew G. Orres,5.0 out of 5 stars,Great!,"Reviewed in the United States on December 28, 2016","Good for you. I'm Christian, but wanted to reverse the unnecessary one star rating you received."
B01NBJP14J,Husseini Islamic Center,Social,A. Versi,5.0 out of 5 stars,Five Stars,"Reviewed in the United States on February 8, 2017",Thanks
B01NBJP14J,Husseini Islamic Center,Social,OE,5.0 out of 5 stars,Great and thank you.  To the one star hater,"Reviewed in the United States on January 1, 2017","In Islam, Jesus, known as Issa عيسى,  peace be upon him, will return before the day of judgement to fight evil, aka Massih eldajal , which in Arabic means false Messiah, aka anti-Christ. So what's your point joyner? Or should I say intolerant bigot?"
B01NBJP14J,Husseini Islamic Center,Social,Aman,5.0 out of 5 stars,Jazak Allah,"Reviewed in the United States on January 7, 2017","Assalam Walekum,Jazak Allah. Very helpf"
B01NBJP14J,Husseini Islamic Center,Social,sherin nssar,5.0 out of 5 stars,Th,"Reviewed in the United States on December 25, 2016",It's helpful app
B01NBJP14J,Husseini Islamic Center,Social,Firepixey,1.0 out of 5 stars,Deport them all.,"Reviewed in the United States on December 25, 2017",We don't want you in the USA.
B01NBJP14J,Husseini Islamic Center,Social,Ali Hussain,5.0 out of 5 stars,Thanks!,"Reviewed in the United States on December 22, 2016",Thanks
