skillid,skillname,category,reviewer,star,title,date,content
B017YAF22Y,Ask My Buddy,Social,Quackenfuss,5.0 out of 5 stars,First Class App for Alexa,"Reviewed in the United States on March 27, 2018","I don't understand the reviews complaining about the cost of the service.  While I have no knowledge of how the web site presented information in 2016 and 2017, at the current time, March 2018, the website if very, very clear about cost.  The service is free if you have fewer than 5 contacts and use 10 or fewer notifications in a 30 day period.  For $3.66 a month you can use 120 notifications per month, and for $5 per month you can get 400 notifications per month, have 10 contacts, and use numerous languages other than English.  I signed up for the free service and tested it and it works flawlessly.  Since I opted for voice call and text, each instance uses 2 notifications, and because I am adding one additional contact, each notification will use 4 notifications.  For that reason I am going back into my account and signing up for the $5 per month option.  I am currently paying $32 per month for a medical alert system for my wife, but she fell this morning and wasn't wearing the necklace so it was of no help.  However, she has and Echo Dot on her bedside table, and if I had signed up for Ask My Buddy sooner, she could have just said, ""Alexa, alert Bill"" and Ask My Buddy would have called my cell phone.  The instructions say that you should say ""Alexa, tell Ask My Buddy to alert (contact name)"", but I quickly discovered that you only need to say ""Alexa, alert (contact name)"", and Alexa will respond with ""I will tell Ask My Buddy to alert (contact name)"".  That may seem lilke and inconsequential difference, but for an elderly person in distress, and possibly with confusion as well, the 3 word command is much surer than the 8 word command.  While I should be able to just say, ""Alexa, call (contact)"", I have found over the past few months that the Echo Dot response to that is spotty.  Sometimes it works, sometimes Alexa just lights up green and beeps, but never makes the call.  In any case, with that, the person in distress would have to communicate via Alexa which at distance could be difficult.  The Ask My Buddy command will send a prerecorded message that will tell you that the person in distress needs help and you should check on them immediately.  This is as good a use of technology as can be devised and I recommend it without reservation."
B017YAF22Y,Ask My Buddy,Social,NYCGuy,5.0 out of 5 stars,How to set up Ask My Buddy for a senior,"Reviewed in the United States on November 3, 2019","Here is how we setup Ask My Buddy for my 97-year-old father who lives alone:1. Living room has an Echo. Bedroom and bathroom each have an Echo dot.2.  Taped next to each Echo device is a cheat sheet for the Ask My Buddy commands, of which he uses two: call all of us for help and tell all of us he's ok.3.  We schedule drills twice a month on the first and fifteenth of each month.  I verify with Pop the procedure and alert the other contacts in advance of each scheduled test.  He issues both commands during each test.4.  We rotate the tests so that he exercises each of his Echo devices in turn.5.  I frequently call in to his Echo device using the Alexa app on my android phone and the ""Drop in"" feature.  This lets me listen to his living room without his having to do anything to receive the call.6.  We will soon implement an additional, daily ""Check-In"" message from Pop to all of us.  Since we talk with him frequently, but not necessarily every day, this step will provide positive confirmation that he is all right at least once a day.These steps are necessary, because unless he rehearses sending messages he might not remember what to say in a real emergency."
B017YAF22Y,Ask My Buddy,Social,An0n1llus10n,4.0 out of 5 stars,Fantastic. Highly recommend. Just wish 1 thing...,"Reviewed in the United States on July 29, 2018","This skill is exactly as advertised. Absolutely fantastic.I only wish you could adjust a setting so you could just say “Alexa, alert so and so” rather than having to say “Alexa, tell MyBuddy to alert...”Could be hard to remember, especially for elderly/disabled persons, to say MyBuddy. Especially in an emergency situation and so infrequently using the skill."
B017YAF22Y,Ask My Buddy,Social,Pene',5.0 out of 5 stars,My er was to late  get yours now I now have added my buddy to Alexa !!,"Reviewed in the United States on October 9, 2016",I had a heart attack n middle of night was alone woke up to hear someone screaming . IT WAS ME!!I couldn't get out of bed nor get to a phone yes I had a heart attack but I lost 2/3 of my heart  ability I wish I had Alexa back thenBut I Do now and trust me don't wait till the er moment and think I should have gotten that Alexa thingNo one has paid me to say this . It comes from my own experience!! Thanks guys for added ing this to Alexa .
B017YAF22Y,Ask My Buddy,Social,Jeff S.,5.0 out of 5 stars,A Perfect Combination of Technologies offering Freedom of Movement and Peace of Mind,"Reviewed in the United States on December 29, 2016","Sometimes technologies can match up so well as to become nearly perfect solutions for some of the most challenging problems we face. Take the task of taking care of our elderly family and friends - Ask My Buddy steps up as one of those perfect solutions. It leverages Alexa's ""always on"" capabilities so that my blind 89-year-old father has the means to call out if his cell phone battery dies (which happened today), he falls or is otherwise in need of help at a time no one is around. This combination skill and service along with the voice-interface that Alexa provides gives my father freedom of movement and all of his family a greater sense of security.In fact, I think this company should be bought out by Amazon and incorporated into all Echo units by default since it offers such a vital service for anyone, not only the elderly, to send a quick message for help. It also isn't bad for Dot sales in that we are now buying 3 more Echo dots for various remote areas of the house to accommodate this skill's capabilites. Ask My Buddy rocks!"
B017YAF22Y,Ask My Buddy,Social,Hawkins,5.0 out of 5 stars,"Thanks,  thanks","Reviewed in the United States on September 2, 2019","I'm a  mature Nurse who lives alone.  Don't let the gray hair fool you,  i still work full time. One night I got very ill and knew I needed help,  with one big breath i asked Alexa to call  my Buddy, before  i hit the floor. She did and they came running calling the ambulance. All is well i just want to say Thanks ."
B017YAF22Y,Ask My Buddy,Social,ROBERT J SMITH,5.0 out of 5 stars,IT DOES NOT GET ANY BETTER!!!!,"Reviewed in the United States on November 27, 2016","My wife has MS and has fallen many times, only to be stuck for hours until someone came home. Echo is now her guardian as well as companion....Thank you so much. Who would of thought this was possible."
B017YAF22Y,Ask My Buddy,Social,Amy A. Dingfield,5.0 out of 5 stars,Perfect piece of mind for parents of new “latch-key” kid this school year!,"Reviewed in the United States on January 9, 2020","My daughter just started middle school this school year and now walks home from school.  We know our child very well and she is not responsible enough to have a standard cellphone.  We bought a tik-talk watch that allows her to call only the contacts we program in it, call 911 in an emergency, receive calls from anyone; that’s a bummer (and not okay for us) but understands it’s the same lesson about “don’t answer the door to anyone that’s not mom or dad!” She can send texts to the contancts in her list, too, and it’s trackable even inside a building!!What makes this app/skill perfect is, when she gets home, locks the door, and sets the house alarm she tells Alexa to have My buddy send everyone a “check-in” and my husband and I are notified via 3 means of communication (text message, email and phone call) that she’s made it home.  We know for a fact that if she had just a cell phone she would not develop this routine and forget to call us, we would be engrossed in our jobs at the time she gets home from school and be completely unaware that she didn’t check-in giving a potential problem a headstart on the clock.  Now I am not saying the skill will save my childs life!  But this skill provides our family some piece of mind, and because of the routine notifications it has helped us to recognize our patterned behaviors and know when we’re doing a specific thing/task during the day is when to expect her notification; again adding that piece of mind!One thing I would change about this skill is the notification system.  I wish it would allow you to choose your preference(s) of notification between text message, email, or phone call or and of those as a combination.  My preference would be to have both the text message and phone call but I don’t need or want the email notifications."
B017YAF22Y,Ask My Buddy,Social,Wally,3.0 out of 5 stars,Alert First Responders By Voice,"Reviewed in the United States on July 8, 2021","I am primarily using AskMyBuddy as an inexpensive Medical Alert system.AskMyBuddy can contact either the Fire or Police departments, however I would, typically, use 911.PROSVery low monthly cost.Voice activated. No need to wear a pendant. (Seniors HATE that pendant.)CONSRequires Amazon Echo smart speaker devices throughout your dwelling. (I have four to cover my 2400 square foot condo.)Very difficult for a senior to set up without help, because it requires AskMyBuddy, Buddy Assist, your smartphone, Alexa, Noonlight, and a lockbox. (Your traditional Medical Alert services are, essentially, turnkey.)The AskMyBuddy commands are too wordy, and could be hard to remember under stress. (This can be solved using an Alexa Routine with a Custom command, e.g. Alexa, Call medical, or Alexa, Help!)I'm eighty years old, but I was a computer guy in my previous life. It was a struggle, but I had fun setting this up. All the pieces are available, but the AskMyBuddy folks need to do some fine tuning."
B017YAF22Y,Ask My Buddy,Social,Stevie P,5.0 out of 5 stars,My Mom Fell,"Reviewed in the United States on August 30, 2017",My mom fell last week and was unable to get up. She alerted family via Ask My Buddy and we were then able to summon EMS. Awesome App
B017YAF22Y,Ask My Buddy,Social,A. Versalles-Curtis,5.0 out of 5 stars,Alert your Alerts!,"Reviewed in the United States on November 28, 2016","Getting signed in and adding contacts was very simple. Just make sure you've gotten a hold of everyone before testing the alert! I thought I texted all my contacts before testing the alert message and missed one. Scared her half to death. After assuring her I was fine we had a good laugh. So, heads up people!"
B017YAF22Y,Ask My Buddy,Social,Jude525,5.0 out of 5 stars,An amazing free service,"Reviewed in the United States on July 18, 2017","I haven't had to use this in an emergency, but I have run a couple tests and the system has worked as hoped. Set up was incredibly easy.While it isn't a factor on the Alexa app, I have to say that the development team is excellent. After setting up on my Echo Dot I contacted the development team about using it on my PC and they were right there explaining what I had missed in the set up. They have followed up twice with me checking if I have questions on either device. You don't usually get service this good for paid apps!I have two conditions that make me prone to falls, but neither one is severe enough for my insurer to pay for a traditional emergency button. Although Ask My Buddy isn't the same as a  911 service, it does take some of the fear away from my being alone. Especially at night when I am tired and most afraid to fall.Finally, if like me, you can't afford the subscription service, consider making a one time donation to the team. It costs them money to run this and, unlike the games we all play daily, there are no in app ads here."
B017YAF22Y,Ask My Buddy,Social,Kindle Customer,5.0 out of 5 stars,Wonderful APP.....Thank You.,"Reviewed in the United States on September 5, 2016","This is a fantastic addition to Alexa.  I pray that I never need it, but, it is comforting to know that as an older lady of 76 if I should fall in my home I may have a chance of getting help.  Thank you so much."
B017YAF22Y,Ask My Buddy,Social,Beverly Keefer,5.0 out of 5 stars,Grateful for Ask My Buddy!,"Reviewed in the United States on February 7, 2018",Two weeks ago my Mom was rushing to get to the beauty shop and fell inside her condo. She asked Alexa to call me and I was able to arrive there within 10 minutes.  Mom and I are so grateful for Ask My Buddy and our Alexa! She had a fractured pelvis and is now on the road to recovery.
B017YAF22Y,Ask My Buddy,Social,Amazon Customer,5.0 out of 5 stars,Works great and I am lucky I have set this up.,"Reviewed in the United States on May 18, 2018","This why I first got an Amazon Echo. Ask My Buddy works great and is great peace of mind for someone like me.  I have taken a few falls and was worried about what to do without my phone being available.  I have now used Ask my Buddy with another fall.  My kids all got the message and when they could not reach me on my phone came over to help me.  I think anyone who lives alone should have something like this, no matter what their age.  Oh I forgot, I use the check in feature every morning to let them all know I am up and about."
B017YAF22Y,Ask My Buddy,Social,KLott,5.0 out of 5 stars,My new buddy,"Reviewed in the United States on January 19, 2018",This is great for those parents or kids that live alone. Highly recommend. And it is free up to 5 contacts.💗💗💗
B017YAF22Y,Ask My Buddy,Social,Carolyn Timmerman,5.0 out of 5 stars,An AMAZING Skill!,"Reviewed in the United States on December 27, 2018","We needed something to help protect a dear loved one in the event he was unable to call for help - for ANY reason. An independent man, who has always taken care of so many others, was willing try out what I initially thought would be a ‘good thing’. I wanted something that was discreet, accurate, easy to use, waterproof (showers), and would last. What I bought, although it has great potential, was not a good fit. It alarmed FREQUENTLY, for no reason. If he heard the alarm ‘voice message’, he could cancel the alert, but more times than not, it sent out alerts and I would contact him to verify he was okay as much as 10 times in a single day! It wasn’t for him. While searching for a more workable solution, I came across Ask My Buddy and thought this could be the ONE! I bought 4 AMAZON Echo/Alexa Dots and shared this skill. He had all the Dots by Thanksgiving; set up 1 Dot just to appease me (read that as...shut me up!). I e-mailed him a lengthy list of all the stuff/skills I use my Alexa for, and he did start with a shopping list. The next morning, he CALLED me via his DOT! He read all the stuff I’d sent, and hooked everything up Thanksgiving night! We enabled the Ask My Buddy skill, tested it out, and it worked beautifully! I can honestly say, I was reduced to tears! So thankful! The Dots were placed strategically around the house; upstairs, downstairs, just outside the bathroom, and the garage - all able to hear from 2 locations - and we are all very pleased. The second best part of my story/review? I learned yesterday that he bought 3 more Dots to give to his sisters...and shared the Ask My Buddy skill! ❤️"
B017YAF22Y,Ask My Buddy,Social,Lora,5.0 out of 5 stars,Works Perfectly,"Reviewed in the United States on June 3, 2019",I just finished setting this up for myself as I live alone. All of my contacts got notified immediately and let me know so we’re all set. I fell and broke my knee a few months ago so I’ve been finding this very exciting to have as it will alert everyone all at once.I was trying to reach one daughter before and she was not available so this gives me back up.
B017YAF22Y,Ask My Buddy,Social,OCShopper,5.0 out of 5 stars,It really works!,"Reviewed in the United States on November 20, 2016","I have mine set up for my mom who lives w me, so when I'm away from home she can activate if necessary. Last night, was being demonstrated on tv and highlighting the &quot;ask my buddy&quot; app.  Well my Alexa heard the command and the next thing I know my cell phone rings and text message is sent telling me to check on my mom! Of course I knew she was fine sitting across the room from me. The kicker was that my husband out of town also called in not knowing it was a &quot;test/mistake&quot; and wanted to make sure everything was ok. Brilliant!!"
B017YAF22Y,Ask My Buddy,Social,Numba,5.0 out of 5 stars,My mom isn't good with electronics and smartphones but this is very easy,"Reviewed in the United States on June 7, 2017",It really works! My mom lives in Hawaii and we're on  the mainland. It works and gives us a sense of peace. My mom isn't good with electronics and smartphones but this is very easy. Highly recommend. Thanks for making this available!
B017YAF22Y,Ask My Buddy,Social,Linda,3.0 out of 5 stars,Too Hard  to Remember,"Reviewed in the United States on November 28, 2017","I am a senior...when my husband passed out I couldn`t think to say ""ask my buddy to call-----""it would be easier to say Alexa, call 911 or call Rob....under stress this was too hard for me....by the time I called someone my husband almost died"
B017YAF22Y,Ask My Buddy,Social,Jane Doe,5.0 out of 5 stars,Oops,"Reviewed in the United States on January 7, 2017","If you have added 'ask my buddy' beware if you have HSN/QVC on the TV & they are demonstrating this. App.I was getting ready for bed one evening when they were demonstrating Echo.  They said Alexa, ask my buddy.  Well, my Alexa woke up & contacted my contacts.  One of my buddies was the speech writer for a large event & in then middle she got the text.  So, I caution you 😝.  It works extremely well"
B017YAF22Y,Ask My Buddy,Social,FelineFriend,5.0 out of 5 stars,Was needed within 2-weeks,"Reviewed in the United States on June 6, 2017","I haven't had to use 'Ask My Buddy' for myself but, I have peace of mind knowing it's there.  I did sign up my parents for this service and 2-weeks later my mom fell down the stairs and injured her hip.  She did not have her cell phone on her and was too far away from the house phones to reach them.  It took about 10-minutes (to get over her initial panic) but, then she remembered 'Ask My Buddy' and called out for help.  I got to her within 30-minutes and was able to call an ambulance.  I am so glad this service is available."
B017YAF22Y,Ask My Buddy,Social,rearview1,5.0 out of 5 stars,Home Alone? A must have!,"Reviewed in the United States on December 7, 2020","This is so helpful, and a safety must have.You just say:  Alexa, ask my buddy for help. and immediately your designated ""buddy"" or buddies receive a phone call and a text. When I go food shopping and my husband- who has severe disabilities - falls, or needs me urgently- can simply call out to Alexa, and I am alerted immediately.  This is awesome... and a relief. :)"
B017YAF22Y,Ask My Buddy,Social,Annette E,5.0 out of 5 stars,"Alexa's version of I've fallen and I can't get up!""","Reviewed in the United States on November 25, 2016",Awesome!! Thank you for creating a way for elderly people to be able to contact their loved ones in the event of an emergency.  This is a great service and I can't recommend it enough.
B017YAF22Y,Ask My Buddy,Social,Elpfan,5.0 out of 5 stars,You've put my friends' minds at ease...,"Reviewed in the United States on September 3, 2017","I am an older disabled widow, living alone, with no way of getting help should I fall or otherwise be unable to get to my phone.  When my best friend showed up a few days ago with an Echo Dot, in hopes that I would be able to use it in an emergency, I immediately began looking for some way to manage this easily.  Last night I found this skill - read many many positive reviews - thought about it overnight - and decided to give it a whirl this morning. I went to the website and signed up first, added my contacts' information, then came back here and enabled the skill and linked it by signing into the site thru the link dialogue above. Then I tested it out with my two friends, and with one small adjustment (Alexa couldn't understand one friend's name, so I went back to the contact page and gave him an easier-to-understand nickname instead) everything worked flawlessly!  It was a very straightforward setup, and now both my friends and myself can breathe a bit easier, knowing that as long as Alexa is working, I can call for help.  Thank you so much, devs!!"
B017YAF22Y,Ask My Buddy,Social,glmccready,3.0 out of 5 stars,"Great idea, difficult implimentation.","Reviewed in the United States on January 6, 2020","I have a rare neuromuscular disease, and sometimes become paralysed.  Ive got echo dots all over the house to help me “control” my environment....lights, temp, locks, even some doors.  I have gone from nearly normal to paralysed in less than 5 minutes....and i need to be medicated immediately. Ive tried to set this up for my wife. During the “testing” phase I’d say “ask my buddy for help ”, and everytime it would suggest i setup the app...which I’d already done mutiple times. So here is the problem, as I figure.  You have to say “ask my buddy to help me..and not “for help”.  Honestly Im not sure I’d remember that as I “go down the rabbit hole”.  Customer support was awesome....but for now still carrying the meds around all the time,  using Alexa’s announce function, boat horns, and carry my phone."
B017YAF22Y,Ask My Buddy,Social,DiscerningConsumer,5.0 out of 5 stars,Better than free,"Reviewed in the United States on August 17, 2017","This is a free service for everyone who has an Amazon Echo. The basic service will let you notify close family/friends in an emergency, and that's all most folks really need. Let the family members and friends you list as emergency contacts know that you've put them down to receive a text or voice call if you have an emergency. (This Echo skill does NOT call 911 directly).Contributing a few bucks a year lets you list more than 5 contacts and is totally optional. Any contribution is a nice way to support an important service, and even if you stop contributing none of your contacts will be de-listed. This Echo app is way cheaper than the emergency alert services that sponsor annoying TV ads for dedicated hardware devices for those living alone.Highly recommended."
B017YAF22Y,Ask My Buddy,Social,Steve Linthicum,5.0 out of 5 stars,Great for Seniors,"Reviewed in the United States on December 9, 2018","We've all seen that commercial ""I've fallen down and can't get up."" The challenge with that line of products is it requires people to wear a wrist band or pendant that holds the button triggering the system. As a resident in a 55+ senior community, and qualifying as a senior by age, I've started helping neighbors put the Alexa Dot - Ask My Buddy solution in place where they can use this skill to issue the ""ask my buddy to alert"" command, contacting neighbors and family when there is an emergency need."
B017YAF22Y,Ask My Buddy,Social,Jim,5.0 out of 5 stars,"I appreciate this was created, however many in need aren't going to remember to say ""Ask My Buddy""","Reviewed in the United States on December 8, 2019","From experience, people in need aren't going to remember or give a crap about saying ""Alexa"" or ""Ask My Buddy"" before they state their need.  What they will say with instinct, realizing there is or isn't a device that can hear them, is something to the affect ""Help me, Help me.  Oh it hurts, I need help, please help me.  Can anyone help me? Call 911 or do something, please help me.""By then, any device, Alexa or otherwise, should have heard at least ""help"" enough to trigger and ask for further information.  ""Do you need me to alert the house, or call 911?""It's a good approach and a good thing for you to start, because this is already necessary and right now.  People in dire need don't think, they just react."
B017YAF22Y,Ask My Buddy,Social,Coco,5.0 out of 5 stars,Ask My Buddy is pure piece of mind !,"Reviewed in the United States on June 7, 2017","Ask My Buddy is pure piece of mind !I have a very active 84 year old Mom and I worry about her falling or somerhing worse, We tested Ask My Buddy from every room in her home which is a 2 bedroom single wide yes that's Alexa listening but I know she will get help anywhere in her home.Mom can alert everyone in our family and a neighbour. If you have an older parent or you are a living breathing human being then Ask My Buddy is for you.Read other reviews it has saved lives !"
B017YAF22Y,Ask My Buddy,Social,Bev,5.0 out of 5 stars,Amazing!! Just try it. You won't be sorry.,"Reviewed in the United States on October 8, 2016","I have not needed to use this skill yet, and I hope I never will, but it is comforting to know it's there. After setting it up (which was so easy and fast) I tested it. I told everyone on my list it was just a test. It worked just like they said it would. Everyone was notified in seconds and I truly mean seconds! Just having it there put my mind and my family members minds a little more at ease. This skill is absolutely amazing. Even if you think you might need it someday but doubt it, just take the seconds to set it up. You won't be sorry. You just never know if or when you may need it."
