skillid,skillname,category,reviewer,star,title,date,content
B01N01I1I4,Gift Genie,Shopping,Tanna B. Bowen,1.0 out of 5 stars,Terrible recognition,"Reviewed in the United States on March 25, 2017","I asked for a gift idea for my husband, and it suggested a princess dress"
B01N01I1I4,Gift Genie,Shopping,Thomas Jadallah,5.0 out of 5 stars,Works Great!,"Reviewed in the United States on February 10, 2017",Gave me ideas on what to buy!
B06Y3S28P6,Ingredients Guru,Shopping,DIY 1,2.0 out of 5 stars,Has trouble finding basic items,"Reviewed in the United States on May 27, 2017",Ask for crunchy peanut butter and you get some peanut butter cereal. Ask for milk and you get a chocolate milk beverage ingredient list. It found Welch's fruit snacks but this app needs a lot of work and better and more specific recognition.
B07J43J36F,Slick Dealer,Shopping,R. Stump,2.0 out of 5 stars,"Great idea, but FAIL!","Reviewed in the United States on October 10, 2018","I cannot get this application to do anything except tell me it's ""about"" information.  Please fix this, I need this in my life!"
B072KFPTNN,GlobalGiving,Shopping,Amazon Customer,5.0 out of 5 stars,Great start - love the GG app on Alexa!,"Reviewed in the United States on August 12, 2017","Love having this info available on Alexa. Would be great to donate directly to a project via Alexa, but a great start in that direction."
B07NNTY3T7,This Week's New Comic Books,Shopping,Lee H.,5.0 out of 5 stars,Nice reminder for comic fans,"Reviewed in the United States on February 18, 2019",Provides a nice reminder to go to your local comic book shop by making a pick of the week and running down the top new releases from major publishers like DC and Marvel.
B07NNTY3T7,This Week's New Comic Books,Shopping,Jason Ruby,5.0 out of 5 stars,yes,"Reviewed in the United States on February 26, 2019",love it. thank you!
B076294GFK,Best Buy,Shopping,J.C. Murray,1.0 out of 5 stars,just wasted 20 minutes of my life,"Reviewed in the United States on December 18, 2019","I just wasted 20 minutes of my life enabling the  Best Buy app through Amazon Alexa, to buy a ""Voice only Deal"" through Best Buy. Was trying to buy a smart outlet, only to find out Alexa was ""having difficulty""... kind of hard to get a ""voice only"" deal, when your ""voice only"" app, sucks... And you can't get the deal... don't waste your time with the Best Buy skill on Alexa."
B076294GFK,Best Buy,Shopping,LARRY,1.0 out of 5 stars,garbage,"Reviewed in the United States on December 18, 2019","Enabled skill, linked account and tried to purchase a voice deal via Alexa. Did not work."
B076294GFK,Best Buy,Shopping,ugagirl5,1.0 out of 5 stars,TERRIBLE app experience,"Reviewed in the United States on December 20, 2019","I followed the instructions that I had to google since it’s not at all intuitive in the Alexa app and eventually linked my account, then placed 5 orders for the 4.99 smart plug voice only deal. Yep. I had to place 5 separate orders since the app only lets you order one at a time. But the orders went throug, so I got over it. Until I received 4 emails 10 minutes later saying that my information cannot be verified, so they cancelled my order.  The email I get tells me no information on how to fix the verification issue that apparently was an issue on 4 of the 5 orders I placed. But they could verify me for one of my orders?  Then when I tried to chat with Best Buy customer service, their chat was down. Seriously?  This was a terrible user experience on both the Amazon side and the Best Buy side. You both can and should be better than this. I won’t be using this app again."
B076294GFK,Best Buy,Shopping,prem kumar,1.0 out of 5 stars,Trouble processing your order,"Reviewed in the United States on December 18, 2019",Alexa says thr was a trouble processing your order. I don't understand why they create these skills when they don't work
B076294GFK,Best Buy,Shopping,ADAM J WITZ,1.0 out of 5 stars,doesnt work properly,"Reviewed in the United States on December 18, 2019","will tell me the deals, but then tells me I dont have a shipping address on my account @best buy.com, which I do, so app is worthless. tries half a dozen times."
B076294GFK,Best Buy,Shopping,RGReth,1.0 out of 5 stars,Don't trust the skill....,"Reviewed in the United States on December 31, 2019",The item prices whatever the skill shows during voice purchase and what you get charged finally on your credit card is completely different.I placed Amazon Alexa Smart Plug for $4.99 on Dec 20... Two weeks later when I reviewed my credit card statements I was charged for $4.99 and additional $20.00 by Best buy.. So on total I was charged for $24.99 where in the voice only deal was just $4.99...Its not just me.. Almost all my friends who placed the voice only deal on Dec 20 for Alexa Smart Plug got charged full price this way....This very poor design..
B076294GFK,Best Buy,Shopping,Amazon Customer,1.0 out of 5 stars,voice deal with linked account fail,"Reviewed in the United States on July 22, 2021","so i wanted a voice only deal, i added it and it stated my default credit card was expired. it told me to go to Bestbuy.com to update the card. i went to bestbuy.com and updated it. then went back to alexa and tried again... it continues to state my credit card is expired even though i updated it😤. i can only get the voice deal on the alexa device and have no wayntonfix this issue... dumb"
B076294GFK,Best Buy,Shopping,aunt brandi,1.0 out of 5 stars,alexa cannot add the voice only deal to my cart,"Reviewed in the United States on August 1, 2019","i tried it on multiple devices. best buy please give me the same price online. this takes too much time and doesnt work well. i am an elite plus member, not that that means anything to you, but i domt have time to play these games, much less sit on hold for someone to transfer me and have to start over again!"
B076294GFK,Best Buy,Shopping,Dan,1.0 out of 5 stars,Profound piece of crap,"Reviewed in the United States on December 18, 2019","impossible to use, rigid, takes forever.  no abilty to add account, shipping address, card or quantity.  instant delete."
B076294GFK,Best Buy,Shopping,Robert Rucciglano,1.0 out of 5 stars,waste of time,"Reviewed in the United States on December 18, 2019",I do have an account. i so have a shipoing address. And I do value my time.
B076294GFK,Best Buy,Shopping,Amazon Customer,1.0 out of 5 stars,trying to order but Alexa doesnt understand.,"Reviewed in the United States on August 1, 2019",i tried to order amazon fire tv stick through Alexa from bestbuy and every single time alexa dont understand my command on bestbuy skill.
B076294GFK,Best Buy,Shopping,Dtho,1.0 out of 5 stars,"Cannot link this app, best buy is an IT trainwreck","Reviewed in the United States on December 19, 2019","I've reset my password a bunch of times, tried to sign in with Google...  Everytime I attempt with Alexa is says my password is incorrect.  Works fine any other time."
B076294GFK,Best Buy,Shopping,LaZaa,1.0 out of 5 stars,PITA,"Reviewed in the United States on December 20, 2019","cannot understand anything except the 1-2 words it's expecting. Checkout is a one way dead end: no back, no cancel, no second thoughts, only option is to kill the skill and start over. was this a school project for kids? in that case it is cool with huge future potential, otherwise this is not meeting any consumer standard."
B076294GFK,Best Buy,Shopping,Roborob,1.0 out of 5 stars,It wouldn't shut up!,"Reviewed in the United States on July 10, 2018","I invoked the skill and it described some deals to me, but I couldn't get it to stop. It just kept repeating them over and over again. I tried ""Alexa, stop!"" and ""Alexa, cancel"", but it just kept repeating the same list of deals over and over until I unplugged my Echo."
B076294GFK,Best Buy,Shopping,Krishna Kiran Cherukuri,1.0 out of 5 stars,doesnt work,"Reviewed in the United States on December 18, 2019",this doesnt work
B076294GFK,Best Buy,Shopping,Timothy M. Arends,3.0 out of 5 stars,Meh,"Reviewed in the United States on September 12, 2020",It couldn’t tell me about my repair status. It couldn’t tell me about my account in general.￼ there are better ways to do whatever this skill offers to do.
B076294GFK,Best Buy,Shopping,mhln1982,4.0 out of 5 stars,Need to use app to link bestbuy account,"Reviewed in the United States on December 20, 2019","First enable the skill, then head to app on phone to finish the link process. Once that was done it was easy, just say open Best Buy and she asks if you want the deals. Then it goes thru the ordering process. My only thing is that Alexa can only order one at a time. Otherwise it was an easy transaction."
B076294GFK,Best Buy,Shopping,Get it done!,1.0 out of 5 stars,Be nice if it worked…,"Reviewed in the United States on July 22, 2021",Added the scale and everything but won’t check out
B076294GFK,Best Buy,Shopping,kc0912,1.0 out of 5 stars,"Best Buy Wyomissing, Pa.","Reviewed in the United States on September 8, 2021","I purchased a stove with extended warranty. The geek squads computer did not flag my stove's cost of repairs as a lemon and that team was not notified for an escalation, and surpassed the allotted repair warranty amount. I received a text that my warranty was canceled and have a broken Samsung 5.9 cu. ft. Flex Duo Free Standing Electric Range Model Number NE59M6850SS stove. I paid $1,500 thinking made a great purchase and paid for the safety of extended warranty . Well that did not work! I talked to many Geek Squad representative's on the phone all around the world truly... took hours and hours of my time. The contract does not state that there is a dollar amount cut off because it is built into the geek squad system. I was told my work orders were deleted, and I wasn't in the computer. I have spent thousands of dollars at Best Buy over the years and I feel this is not right. The only thing they offered me was to purchase another warranty for $299, but that wouldn't cover parts."
B076294GFK,Best Buy,Shopping,Amazon Customer,1.0 out of 5 stars,watch for unauthorized charges on voice only deals,"Reviewed in the United States on December 21, 2019",i ordered an amazon smart plug for 4.99 on voice only deal and then the next day was miraculously charged an extra $21 which is unauthorized. will not use this service again. had to call corporate and deal with a refund. if i didnt check my bank account i wouldnt have known.
B076294GFK,Best Buy,Shopping,Amazon Customer,1.0 out of 5 stars,If it only worked...,"Reviewed in the United States on August 2, 2019",Linked my Best Buy account.  Can hear voice only deals but it would be nice if it worked!
B076294GFK,Best Buy,Shopping,Tekarchy,1.0 out of 5 stars,Worthless,"Reviewed in the United States on December 24, 2019",Tried to order voice-only special. You could only order one at a time through the voice routine so I had to go through it multiple times. Best Buy then decided to cancel my orders. Never received an email or any other notification.
B076294GFK,Best Buy,Shopping,Kai Frenay,1.0 out of 5 stars,Voice Only Deals a flop,"Reviewed in the United States on December 3, 2020","When prompted for Best Buy's voice only deals, Alexa only gives you the Deals of the Day list. And who thought it was a good idea to one by one list every single voice deal...  itd take 10 minutes to hear the full list. cmon Amazon programmers you are smarter and capable of more than this....."
B076294GFK,Best Buy,Shopping,Nothing original ,1.0 out of 5 stars,Useless,"Reviewed in the United States on December 19, 2019","I’m not going to waste anymore time on this than I already have. Just read the other 1 star reviews. They all speak the truth. I’m going to try to submit with zero stars, because that’s my opinion. Will it let me???.....It did not. 1 star it is. Good luck."
B076294GFK,Best Buy,Shopping,Eric ,1.0 out of 5 stars,Doesn't work for voice only deals.,"Reviewed in the United States on December 20, 2019",Doesn't work for voice only deals. I then chatted with the online best buy help and they tell me I have to buy an echo to get that deal. Waste of time :-(
B076294GFK,Best Buy,Shopping,Ed,1.0 out of 5 stars,Does not work,"Reviewed in the United States on December 19, 2019","Sadly, does not work.  Don't waste your time.  Then if you call Best Buy, they won't honor the deals that don't work on the skill."
B076294GFK,Best Buy,Shopping,Violeta,5.0 out of 5 stars,Works great for me,"Reviewed in the United States on December 21, 2019","Not sure of all the negative reviews, but it worked great for me. I was able to get it to work with no problem. linked my best buy account and i got an amazon plug for $5 from best buys voice deals with no issues. i do want to mention i did not use the alexa app to get voice deals, i asked my Echo for the best buy voice deals."
B076294GFK,Best Buy,Shopping,NA,1.0 out of 5 stars,Doesn’t work,"Reviewed in the United States on August 1, 2019",It is not ok to advertise something abd sell it thru a  way that will not work propperly
B076294GFK,Best Buy,Shopping,M. Boyd,5.0 out of 5 stars,Must have CC on file with Best Buy,"Reviewed in the United States on December 21, 2019","I had a lot of the same problems others are reporting advising unable to process.  I contacted Amazon help.  My payment with Best Buy wasn't current, as soon as I fixed that it worked!"
B076294GFK,Best Buy,Shopping,Dima,1.0 out of 5 stars,Alexa “ I’m having trouble processing your order”,"Reviewed in the United States on December 19, 2019",Alexa “ I’m having trouble processing your order”
B076294GFK,Best Buy,Shopping,CL,1.0 out of 5 stars,Wouldn’t order. Kept asking to try again later.,"Reviewed in the United States on August 6, 2018","Aside from being very difficult to navigate (having to exactly say Best Buy’s commands that aren’t familiar), I finally got it to where I could order something and kept rejecting my order. Also, tried to save item in a cart to easily revisit and couldn’t figure it out if there is such a feature. Gave up in the end."
B076294GFK,Best Buy,Shopping,Ricky L Jones,3.0 out of 5 stars,Decent Skill App,"Reviewed in the United States on January 18, 2021","Seems ok, worked ok but couldn't get Amazon Smart Plug deal."
B076294GFK,Best Buy,Shopping,Joe,1.0 out of 5 stars,Won’t Ship,"Reviewed in the United States on July 22, 2021",Kept saying that my Bestbuy account has no default shipping when it clearly has it on my BB App! what a waste!
B076294GFK,Best Buy,Shopping,Jarred,1.0 out of 5 stars,awful,"Reviewed in the United States on December 8, 2020","tried to get the smart plug deal, took me 6 times to go through it all, and then it was telling me to pick it up in California, where i used to live, even though my Best Buy account was updated to my current location and there was no way to change it. this is worthless."
B076294GFK,Best Buy,Shopping,Doktorek,1.0 out of 5 stars,linked but trouble processing message,"Reviewed in the United States on December 19, 2019","i linked it, tied to put item into card and it says im having trouble adding or processing the order"
B076294GFK,Best Buy,Shopping,NE55,1.0 out of 5 stars,DOES NOT WORK,"Reviewed in the United States on December 19, 2019",Linked best buy to alexa. nothing works. Not even other stuff.
B076294GFK,Best Buy,Shopping,JRA,1.0 out of 5 stars,single item purchase only,"Reviewed in the United States on December 1, 2020","Voice purchase for single item only, if you add items to your cart it tells you to checkout on the website or app."
B076294GFK,Best Buy,Shopping,Cedric & Tina,5.0 out of 5 stars,It works!!!,"Reviewed in the United States on July 5, 2020","Seen reviews from December 2019 and was skeptical to use the skill, connected it and used it anyways, works perfectly on my phone and even works in my 2016 Lexus, made it really convenient to order and pick up curbside."
B076294GFK,Best Buy,Shopping,Robert H.,1.0 out of 5 stars,Cumbersome and long winded,"Reviewed in the United States on December 1, 2020",Way more trouble than just using a computer or smart phone.
B076294GFK,Best Buy,Shopping,twm,1.0 out of 5 stars,"Not a skill, a headache.","Reviewed in the United States on December 2, 2020",long winded 'skill' that does nothing but repeat itself or error out.
B076294GFK,Best Buy,Shopping,Pashi,1.0 out of 5 stars,it's not even linking,"Reviewed in the United States on December 19, 2019",i tried tons of time to link Alexa with BB but it simple doesn't work
B076294GFK,Best Buy,Shopping,Eric,1.0 out of 5 stars,Deal of the Day Voice Loop!!!,"Reviewed in the United States on July 13, 2018",Asked about the voice only deals and it kept repeating them over and over. It stopped when I touched the screen on the echo show.
B076294GFK,Best Buy,Shopping,Marie Muniz,1.0 out of 5 stars,Useless skill,"Reviewed in the United States on December 19, 2019",Tried for 20 minutes & Alexa kept either trying to download a weird 3rd party app or telling me I'm unable to access this skill. Finally just turned it all off & gave up. Google assistant is much easier to use.
B076294GFK,Best Buy,Shopping,Tim Wilson,3.0 out of 5 stars,"Nice, but needs im","Reviewed in the United States on November 3, 2017","I asked about the deals of the day, and Alexa asked me if I wanted to buy each deal. On days where there are a lot of deals, this could be very annoying."
B076294GFK,Best Buy,Shopping,Richard Little,5.0 out of 5 stars,"used it for the first time yesterday, no problems","Reviewed in the United States on December 20, 2019",worked fine after adding info on my bestbuy.com account. ordered multiple voice only specials.
B076294GFK,Best Buy,Shopping,swapnil,1.0 out of 5 stars,total garbage,"Reviewed in the United States on December 20, 2019",multiple time tried and eveytime said cannot complete the request at this time. “can i do anything else for you ?” lol just work.skill written by non qualified for sure.
B076294GFK,Best Buy,Shopping,Sal,1.0 out of 5 stars,... the deals on my echo show that would be better i dont want to hear deals that i cant ...,"Reviewed in the United States on July 14, 2018",if i could see the deals on my echo show that would be better i dont want to hear deals that i cant see.  you would think best buy would have thought of that.
B076294GFK,Best Buy,Shopping,S. Pridgen,1.0 out of 5 stars,Fix it!!!!,"Reviewed in the United States on July 12, 2018",I had the same issue as a previous reviewer. Alexa kept repeating the deals and would not stop. I had to unplug my Echo because Alexa would not respond to any of my commands.
B076294GFK,Best Buy,Shopping,Charles L. Powers,1.0 out of 5 stars,Does not work,"Reviewed in the United States on December 21, 2019",Says i need to add a primary shipping address which i already have.
B076294GFK,Best Buy,Shopping,Jason J.,1.0 out of 5 stars,waste of time,"Reviewed in the United States on December 1, 2020",Wasted time on this Best Buy skill.  Don't waste your time.  It didn't work as intended and was extremely frustrating.
B076294GFK,Best Buy,Shopping,Gun Youm,1.0 out of 5 stars,Don't waste your time to voice only deal,"Reviewed in the United States on December 3, 2020","I keep try to add,Amazon smart plug through voice only deal. But there is no way to check out. It is weirded and waste if time."
B076294GFK,Best Buy,Shopping,Roberto M.,1.0 out of 5 stars,IT won't work,"Reviewed in the United States on December 20, 2019","Linked my best buy account, then tried several times to buy a smart plug but Alexa always replies with “I’m having trouble processing your order”, over and over, waste of time"
B076294GFK,Best Buy,Shopping,Peter,1.0 out of 5 stars,Accounts linked; Credit Card added; but still not working,"Reviewed in the United States on December 20, 2019","worst of all, I have a feeling that the customer service representative doesn't know how to resolve this issue, so she started pretending that she couldn't hear me"
B076294GFK,Best Buy,Shopping,Jacqueline A,5.0 out of 5 stars,Best Buy voice deals,"Reviewed in the United States on December 20, 2019",alexa linked with best buy with no problem. I was able to order my smart plugs.
B076294GFK,Best Buy,Shopping,nickie,1.0 out of 5 stars,Do Not Use- Poor Customer Service From Best Buy,"Reviewed in the United States on December 21, 2019","Terrible app that doesnt make your purchase. Even worse, when you call Best Buy to complete the purchase, they wont do it."
B076294GFK,Best Buy,Shopping,Tina Heath,1.0 out of 5 stars,Gimmick,"Reviewed in the United States on December 20, 2020",kept trying for the $.99 smartplug what a waste of my VALUABLE TIME.  Doesn't give you the deal.  What a gimmick!
B076294GFK,Best Buy,Shopping,Rachel F. Waldron,1.0 out of 5 stars,Trouble processing for 2 days straight!,"Reviewed in the United States on December 20, 2019",needs more work! giving Alexa a chance my preference is google but figured i give amazon a chance 1st.
B076294GFK,Best Buy,Shopping,Amazon Customer,1.0 out of 5 stars,Does not work!!! very frustrating,"Reviewed in the United States on December 21, 2019",will not link. continuously says need toupdate profile. well how do you update ?
B076294GFK,Best Buy,Shopping,Bryan,1.0 out of 5 stars,Voice Purchase does not work,"Reviewed in the United States on December 20, 2019","after linking my account, voice purchases are still not working. useless."
B076294GFK,Best Buy,Shopping,Sumanth J.,1.0 out of 5 stars,trouble processing order message,"Reviewed in the United States on December 20, 2019",not working and simply says trouble processing order which is not at all helpful..
B076294GFK,Best Buy,Shopping,Carl,1.0 out of 5 stars,Skill is junk,"Reviewed in the United States on December 20, 2019",Alexa won't add any deals because the device thinks I dont have a primary shipping address setup on bestbuy.com.  I tried disabling and reclining still no luck.  Waste of time.
B076294GFK,Best Buy,Shopping,Peggy Bolton,1.0 out of 5 stars,Can’t use Rewards,"Reviewed in the United States on December 19, 2019",It does not allow using Rewards Cash as payment on orders placed with Alexa.
B076294GFK,Best Buy,Shopping,ankireddy,5.0 out of 5 stars,impressive,"Reviewed in the United States on December 1, 2020",too many yes to buy thats something best buy needs to fix
B076294GFK,Best Buy,Shopping,Yan Xie,1.0 out of 5 stars,not working,"Reviewed in the United States on December 20, 2019",saying has teouble processing my order when using voice order.
B076294GFK,Best Buy,Shopping,Tony L,1.0 out of 5 stars,This is trash. Waste of time.,"Reviewed in the United States on December 2, 2020",This is trash.
B076294GFK,Best Buy,Shopping,Stephen,5.0 out of 5 stars,Great!,"Reviewed in the United States on February 13, 2022",Great experiences with Best Buy purchases and Geek squad also.
B076294GFK,Best Buy,Shopping,Le Horton,1.0 out of 5 stars,BestBuy + Alexa = nothing “best” about it,"Reviewed in the United States on December 27, 2018","Using Echo Show 2nd Gen. Launched properly after 3x attempts. Audio was good except for Of the (very limited) things it can do, only one of those actually worked. Showed tenof “today’s deals”, of which #’s 3-5: audio glitches froze screen; skipped the #4deal;  repeated same deal for #’s 3.Frustrated & ended up using iPhone BestBuy app instead."
B076294GFK,Best Buy,Shopping,DealChaser,1.0 out of 5 stars,POS wouldnt work with alexa,"Reviewed in the United States on August 2, 2019",First and last alexa sh$t for me
B076294GFK,Best Buy,Shopping,Marc R,1.0 out of 5 stars,awful set up,"Reviewed in the United States on August 1, 2019",couldn’t link
B076294GFK,Best Buy,Shopping,cyber,5.0 out of 5 stars,love it,"Reviewed in the United States on December 18, 2019",Best Buy does it again. Has voice only specials at great prices. I love it.
B076294GFK,Best Buy,Shopping,njordan34,5.0 out of 5 stars,Works great!,"Reviewed in the United States on December 18, 2019",Connected easily and worked all the way through with voice only deals. Will check it daily for sure!
B076294GFK,Best Buy,Shopping,Amazon Customer,5.0 out of 5 stars,Getting better over time,"Reviewed in the United States on April 20, 2018",I’ve noticed new features being added over time.  One of the better skill experiences I’ve had
B076294GFK,Best Buy,Shopping,Amazon Customer,5.0 out of 5 stars,Easy to use - great way to find deals!,"Reviewed in the United States on November 13, 2017",Really easy to use skill and I love how it gives me the opportunity to see deals from Best Buy. Very forward thinking on Amazon's part.
B076294GFK,Best Buy,Shopping,Ashok Vardhan Cheemakurthy,5.0 out of 5 stars,Awesome skill,"Reviewed in the United States on November 22, 2019",You guys are putting in some great content. Love it. Keep doing whatever you’re already doing coz it’s working
B076294GFK,Best Buy,Shopping,Melissa,5.0 out of 5 stars,This is awesome! I love being able shop the Deal of ...,"Reviewed in the United States on November 9, 2017",This is awesome! I love being able shop the Deal of the Day at Best Buy from my Echo device. It's the best of both worlds. Kudos!
B076294GFK,Best Buy,Shopping,BB,5.0 out of 5 stars,Great!,"Reviewed in the United States on January 14, 2018",Pretty cool
B076294GFK,Best Buy,Shopping,Dmace1,5.0 out of 5 stars,Uh,"Reviewed in the United States on November 19, 2017",Yes
B076294GFK,Best Buy,Shopping,Donald Goeser,2.0 out of 5 stars,Great idea but wrong store,"Reviewed in the United States on November 10, 2017",Great idea but wrong store........personally Best Buy is not a wonder into store.  Every time I have been there and I even have there card was for specific product.  You did get the sale if you person showed up and had a clue.
B076294GFK,Best Buy,Shopping,JA,1.0 out of 5 stars,Not working,"Reviewed in the United States on December 21, 2019",cannot process
