skillid,skillname,category,reviewer,star,title,date,content
B079TYHCYX,myChevrolet,Connected Car,FDoS,2.0 out of 5 stars,Share your PIN with the world!!,"Reviewed in the United States on September 3, 2020","Only place this is useful is by yourself in your home.  If you want to start your car,  say in the mall or store while walking to your car,  use the Chevrolet app.  If you want to ask Alexa to start your car from the phone,  you'll have to speak low so others won't hear and then Alexa doesn't always understand....or, just yell out your PIN to your phone so Alexa will understand (along with everyone else. :)Cool concept but limited by privacy concerns."
B079TYHCYX,myChevrolet,Connected Car,M & M,5.0 out of 5 stars,great technology when I'm looking for me keys,"Reviewed in the United States on November 16, 2019","I have the app for my car, when I'm trying to Hussle out of the house now I can easily ask Alexa to start my car. I love it because I don't have to dig for my key fob and life has just been made easier!"
B079TYHCYX,myChevrolet,Connected Car,KENT E,2.0 out of 5 stars,Incorrectly reporting duplicate vehicles,"Reviewed in the United States on March 25, 2021","If I have both of my vehicles ""Blazer AWD"" and ""Trailblazer AWD"" linked to this skill, The skill doesn't work for either vehicle and incorrectly reports an error saying I have multiple vehicles with the same name. If I only have one vehicle linked to the skill at a time, either one works fine. Contacted Amazon for support on skill, they suggested contacting the skill developer and gave me a number for a GM Onstar advisor. The Onstar staff were friendly and tried to help, but didn't have next steps for trying to resolve. Not a huge issue, mobile app works and I can use Alexa for one car. Just passing this information along to the developer, I'm guessing I'm not the only one with this issue."
B079TYHCYX,myChevrolet,Connected Car,cptboblo,2.0 out of 5 stars,Great idea but a lot of bugs.,"Reviewed in the United States on April 20, 2019","I agree with the other people writing reviews. You should be able to name the vehicles especially if you’re like me and I have more than one Chevrolet. Also, the Command you need to give is too much. However, the biggest problem I had was getting it to link in the first place. Other than that I think if they work out the bugs this will be a great skill for Alexa."
B079TYHCYX,myChevrolet,Connected Car,Kurt Brandemihl,1.0 out of 5 stars,remove pin,"Reviewed in the United States on November 10, 2018",not a security risk when alexa knows who I am and my car cant be driven without remote
B079TYHCYX,myChevrolet,Connected Car,flaviof,2.0 out of 5 stars,learn my voice and stop asking for the pin number,"Reviewed in the United States on March 2, 2020",i do not want to say that pin number every time  please make it better
B079TYHCYX,myChevrolet,Connected Car,Amazon Customer,5.0 out of 5 stars,too cool,"Reviewed in the United States on December 13, 2018",Its very nice being able to start car while doing other things with hands. it would be nice to shorten amoount of commands.
B079TYHCYX,myChevrolet,Connected Car,C. Haggins,5.0 out of 5 stars,Love skill.. No need to open phone app!,"Reviewed in the United States on January 5, 2019",Love this skill!  My spouse was completely speechless the 1st time hearing me use the Alexa skill to start my vehicle!!! I use skill easily when finishing up getting dressed to head out the door!
B079TYHCYX,myChevrolet,Connected Car,michael sohyda,1.0 out of 5 stars,arguing with Alexa,"Reviewed in the United States on February 27, 2020","I can say the same exact thing I said yesterday to start my chevrolet, she goes ignorant. Did you ask about planes? Then starts talking about a 747. I could make a youtube channel, arguing with Alexa. For some reason, she just hates starting the car. ole Alexa acts like she has to walk outside in the cold in shorts, barefoot, while its 5 degrees out to start my chevy. Literally argued for 3 minutes and finally ""Did you mean start my chevrolet?"" YES TOR THE 50TH TIME YES GOOD LORD. WHY IS IT SO DIFFICULT 1 time and the next she does it right away."
B079TYHCYX,myChevrolet,Connected Car,Troy Sanders,4.0 out of 5 stars,Great app.,"Reviewed in the United States on December 27, 2018","I downloaded the app, signed in and started my Equinox. it was quick and easy to use works great. I would have given five stars if i could see the vehicle stats as well. Also, i am not fond of having to say my pin Everytime especially if there are other people around when I use the app. other than that I love it!"
B079TYHCYX,myChevrolet,Connected Car,Karen D. Lontka,4.0 out of 5 stars,Works well but one small issue,"Reviewed in the United States on February 3, 2019","I use it every morning in cold weather to warm up my Volt and it works well.  That said, it would be nice to have an option to turn off the explanation of what ""MyChevrolet"" can do, at full volume (it doesn't honor whisper mode) when it doesn't understand what was said."
B079TYHCYX,myChevrolet,Connected Car,Paul J. Reed,1.0 out of 5 stars,No longer works.,"Reviewed in the United States on October 25, 2019","Ask Chevrolet to start my car, somehow turns into Alexa playing a song by Keith Urban. Or it asks me if I want it to turn all hue lights."
B079TYHCYX,myChevrolet,Connected Car,Amazon Customer,4.0 out of 5 stars,Suddenly would not work,"Reviewed in the United States on February 6, 2021",The remote start skill had worked properly for 2 years and today the skill did not work.  I had to disable the skill in the Alexa app and then re-launch it. Works fine again.
B079TYHCYX,myChevrolet,Connected Car,Ashley Jones,5.0 out of 5 stars,Used to work well.,"Reviewed in the United States on May 17, 2020",About 1-2 years ago I started using this skill. Since then it can be a struggle. The commands changed and or Alexa doesnt always work with the same command. I stopped using it for a few months. Using it again now. I belive what it comes down to is the user learning the correct commands for Alexa not Alexa knowing the right commands.
B079TYHCYX,myChevrolet,Connected Car,NICKI,5.0 out of 5 stars,Chevy Cruze 2019,"Reviewed in the United States on August 7, 2021","All I have to say is this skill is AMAZING !!  WELL, it was amazing until I found out how much extra I had to pay for OnStar!  No Thanks"
B079TYHCYX,myChevrolet,Connected Car,DRK,1.0 out of 5 stars,How about EVs?,"Reviewed in the United States on February 23, 2022",Won't give me a battery level. Not interested in how much gas I have left. Want to know how much battery range I have remaining.
B079TYHCYX,myChevrolet,Connected Car,Nick laPointe,5.0 out of 5 stars,works perfectly,"Reviewed in the United States on January 3, 2021",starts my truck everytime easily
B079TYHCYX,myChevrolet,Connected Car,Tammy,1.0 out of 5 stars,app not working.,"Reviewed in the United States on February 22, 2021",I tell alexa to Start my Vehicle and ahe doesnt know that command. I ask Alexa to open up My Chevy app and alexa gives me a list of chicea ans Start my vehicle is one. 🤬
B079TYHCYX,myChevrolet,Connected Car,emaN neP,4.0 out of 5 stars,I found the problem...,"Reviewed in the United States on June 26, 2020",language was set to UK English and Alexa was unable to recognize...All good now! 4 starts bc command is a mouthful and totally unneccesary imho. Please consider Somerton 'short and sweet'
B079TYHCYX,myChevrolet,Connected Car,Jared Randall,3.0 out of 5 stars,lose the mandatory verbal pin,"Reviewed in the United States on October 30, 2019","please make a way to remove having to say my pin in front of people. if my phone is unlocked, i should have ample security needed."
B079TYHCYX,myChevrolet,Connected Car,SavvyMatthew,4.0 out of 5 stars,Works Well have no problems,"Reviewed in the United States on January 7, 2019","Works as expected, I sometimes forget it requires a pin, but I understand the reasons why it exists. All you need is your nosey neighbor unlocking your car.😆"
B079TYHCYX,myChevrolet,Connected Car,Dr. Terrible,1.0 out of 5 stars,update makes this more of a hassle,"Reviewed in the United States on December 25, 2019","its now easier to go to my coat and start my car with the fob. having to kee entering my pin is stupid and not secure. also, i used to be able to say “alexa, start my car” and now it wants me to call out CHEVORLET by name. thats stupid. very very stupid forced branding.allow us to change it back."
B079TYHCYX,myChevrolet,Connected Car,Kiersten,5.0 out of 5 stars,Gonna Be handy!,"Reviewed in the United States on November 20, 2020",Just got this skill and tested it out. Now I am so ready for these cold days and I can start my car without going to the window. It is faster to start than the MyChevy app in my opinion. I love it!
B079TYHCYX,myChevrolet,Connected Car,Jason Conner,2.0 out of 5 stars,PIN Requirement,"Reviewed in the United States on November 5, 2019",Great skill but not very secure having to verbally give my pin in front of others. Please include an option to permanently configure the pin so we dont have to give it every time .
B079TYHCYX,myChevrolet,Connected Car,akasoo313,1.0 out of 5 stars,Does not replace Google Voice assistant while in vehicle,"Reviewed in the United States on March 30, 2021",Terrible experience. Trying to install Alexa to 2021Chevrolet Bolt. The Alexa App does not show on the Chevy Bolt Infotainment screen and there's no way to install itHelp!
B079TYHCYX,myChevrolet,Connected Car,JTE,3.0 out of 5 stars,"“Okay, lock your vehicle. What’s your PIN?”","Reviewed in the United States on May 28, 2021","I’m not sure how the developers have missed the fact that nearly every single review complains about the two step process to enter a PIN.The app “works” fine, but it’s not very convenient and useless with Alexa routines because of the fact that you have to announce your PIN verbally on every command.Seriously, either remember the PIN or at the very least allow me to include it in the original command."
B079TYHCYX,myChevrolet,Connected Car,S. ferris,3.0 out of 5 stars,Will not understand the word vehicle,"Reviewed in the United States on April 2, 2020","This skill will not start if I say ""Alexa, start my vehicle."" she goes on about knowing airplanes.. my son asked Alexa to start my vehicle in a super Mario accent, and she understood. then just to see what would happen, we said ""Alexa, start my airplane."" and the skill worked... totally confused. both my dot and my echo do this, and it doesn't matter who asks."
B079TYHCYX,myChevrolet,Connected Car,J. L.,1.0 out of 5 stars,Very Limited Functionality,"Reviewed in the United States on March 31, 2019","I also have the BMW Connect skills, which has the ability to provide other information as to the level of charge / available range and more, in addition to locking and unlocking doors...etc. Hope there is an update soon that adds other useful features."
B079TYHCYX,myChevrolet,Connected Car,Nicholas,2.0 out of 5 stars,Security restricts it utility.,"Reviewed in the United States on September 5, 2020",Same comment as others below. Somehow Alexa needs to provide a more discreet and convienient means of supplying the PIN to the skill. Nice try though Chevy.
B079TYHCYX,myChevrolet,Connected Car,Dave,1.0 out of 5 stars,will not connect,"Reviewed in the United States on March 26, 2021",Will not work with Galaxy S9 plus
B079TYHCYX,myChevrolet,Connected Car,pjcalandro,1.0 out of 5 stars,Will not link,"Reviewed in the United States on June 19, 2021","I have spent many of hours on the phone with both Alexa and Onstar… Alexa blames onstar, onstar just keeps telling me to reset everything and pushing me off on someone else!what happen to the days of customer service, when you could call tech support and acually get support!"
B079TYHCYX,myChevrolet,Connected Car,Jon,5.0 out of 5 stars,Works for me!,"Reviewed in the United States on February 16, 2020",I don't normally write reviews on these apps but I have seen so many negitive ones I felt the need to say it works great for me.  I have a 2020 Silverado and no problems with it.  I would like to not have to be transfered to the App when I say start my truck but it takes a couple of extra seconds. one thing to improve I would like it to locate my vehicle.
B079TYHCYX,myChevrolet,Connected Car,epk,1.0 out of 5 stars,NG,"Reviewed in the United States on February 25, 2022",This app is terrible since the last update.  Go back to the drawing board people and fix this.
B079TYHCYX,myChevrolet,Connected Car,Mike Cruz,5.0 out of 5 stars,Link the App works great.!,"Reviewed in the United States on February 25, 2021",Wow this App works great i ask Alexa to turn on My truck and it goes on i ask for tire presure and lets me know and if ask to lock truck she will. Only thing is i have to give here my pass code all the time but is okay a good securty feature.
B079TYHCYX,myChevrolet,Connected Car,smb683,2.0 out of 5 stars,Asking for my PIN?  YIKES!!!,"Reviewed in the United States on August 28, 2020","it works, but...... There's got to be a better way than to have me announce out loud what my PIN is. Perhaps set it up in the app so it remembers my PIN without audibly asking every time."
B079TYHCYX,myChevrolet,Connected Car,Robert F.,2.0 out of 5 stars,“I can do multiple things”,"Reviewed in the United States on March 31, 2021",every time i ask Alexa to “have chevrolet start my vehicle” she just says “i can do multiple things. just say.....” and then i have to repeat it and she then tells me that shes unable to do that!
B079TYHCYX,myChevrolet,Connected Car,John Amoroso Jr,5.0 out of 5 stars,Love it,"Reviewed in the United States on November 28, 2018",Works great I love it especially now that it's winter.
B079TYHCYX,myChevrolet,Connected Car,RDA1990,1.0 out of 5 stars,Get Ride of Pin,"Reviewed in the United States on November 16, 2019",Allow me to save my pin like you do on the Apple Watch and or remove it so I don’t have to give alaxa the pin if I tell alaxa the pin once.
B079TYHCYX,myChevrolet,Connected Car,RDH,1.0 out of 5 stars,Will not link account,"Reviewed in the United States on July 6, 2021",Will not link after logging in. Keeps giving same message when i try to log in to my Chevy/OnStar account. “input entered was invalid”
B079TYHCYX,myChevrolet,Connected Car,James W,2.0 out of 5 stars,hate announcing my pin,"Reviewed in the United States on September 27, 2019",it works but it sucks that I have to say my pin out loud
B079TYHCYX,myChevrolet,Connected Car,Jody,5.0 out of 5 stars,links and works just fine,"Reviewed in the United States on January 23, 2020","works great for both our vehicles, no issue linking at all."
B079TYHCYX,myChevrolet,Connected Car,Donald Olsen,4.0 out of 5 stars,works amazingly well just one issue,"Reviewed in the United States on January 5, 2019",i love this skill the speed of use is excellent but the one big issue i have is that it will only work on one of my cars because they are the same type of car so i can't distinguish them from each other.
B079TYHCYX,myChevrolet,Connected Car,Michael Sarka,2.0 out of 5 stars,Can't expect too much,"Reviewed in the United States on February 28, 2021","The information says you can connect all GM/Chevrolet vehicles from 2011 to present however, when asking Alexa to access the diagnostic commands to my 2012 Malibu, Alexa cannot because it is not supported.So folks don't expect alot from this. Technology is not always our friend."
B079TYHCYX,myChevrolet,Connected Car,Jerod C.,5.0 out of 5 stars,Aw,"Reviewed in the United States on August 1, 2018",Been waiting forever for this skill
B079TYHCYX,myChevrolet,Connected Car,Bryan DeWitt,1.0 out of 5 stars,unable to link,"Reviewed in the United States on September 25, 2021","Constantly receiving invalid input message even though I’ve confirmed the password, and made sure onstar was linked in myChevy app"
B079TYHCYX,myChevrolet,Connected Car,Rory,2.0 out of 5 stars,Bolt VS Volt,"Reviewed in the United States on March 18, 2019","I own 2 Chevrolet cars, one is a Bolt and the other is the Volt. Alexa or this app CANNOT get it right. you have to repeat rhe name 10 times, and then it ends up with the wrong car anyways."
B079TYHCYX,myChevrolet,Connected Car,Shannon Franklin ,2.0 out of 5 stars,Always have to Launch it from the app!,"Reviewed in the United States on January 30, 2022",i have to get on my Phone everytime and relaunch this. please fix this!
B079TYHCYX,myChevrolet,Connected Car,Lee Buskey,3.0 out of 5 stars,meh...,"Reviewed in the United States on May 23, 2020","its a cool feature, however, not allowing me to store my pin and instead making me ssy it out loud every time is stupid."
B079TYHCYX,myChevrolet,Connected Car,John S.,1.0 out of 5 stars,Will not link,"Reviewed in the United States on January 25, 2022",tried everything and can not get this to link
B079TYHCYX,myChevrolet,Connected Car,Amazon Customer,1.0 out of 5 stars,NEVER works!!,"Reviewed in the United States on January 27, 2022",why even make this if its not going to work?
B079TYHCYX,myChevrolet,Connected Car,Prashant Bondada,4.0 out of 5 stars,Works well,"Reviewed in the United States on February 17, 2019","Works well to remote start the car. Would like more functionality, like being able to tell me how much range I have left."
B079TYHCYX,myChevrolet,Connected Car,CHAUNCYGARDNER,5.0 out of 5 stars,installs & works great with original Chevy ap security,"Reviewed in the United States on January 7, 2020",pin number requirement keeps unauthoriezed from accessing vehicle via Alexa command.
B079TYHCYX,myChevrolet,Connected Car,David D Hall,1.0 out of 5 stars,Useless,"Reviewed in the United States on August 13, 2021",Unable to link account! How freakin' hard can it be?
B079TYHCYX,myChevrolet,Connected Car,Amazon Customer,1.0 out of 5 stars,won't link account,"Reviewed in the United States on July 27, 2021",have tried over and over. making sure info is correct but it just wont link up
B079TYHCYX,myChevrolet,Connected Car,Chris Lougheed,3.0 out of 5 stars,Limited Functionality,"Reviewed in the United States on January 17, 2020","All you can do is what's on the commercial. Would be helpful to be able to check tire pressure, oil life, and fuel level, or set up alerts so the notification light would blink in the morning if your fuel was below a certain level."
B079TYHCYX,myChevrolet,Connected Car,Zachary,1.0 out of 5 stars,Same pickups,"Reviewed in the United States on March 5, 2020",I have two of the same vehicles and can’t rename them to work separately. It will do every command to both of them
B079TYHCYX,myChevrolet,Connected Car,Amazon Customer,3.0 out of 5 stars,start my car,"Reviewed in the United States on October 22, 2020",i agree having to ask alexa to have chevrolet start my car is annoying. im okay with pin but wish we could set routine alexa im ready to leave and car starts would be great
B079TYHCYX,myChevrolet,Connected Car,stitchemd,5.0 out of 5 stars,Definitely a must for Chevy Owners,"Reviewed in the United States on October 28, 2018",Great to have a skill that allows me to do what in the past would require a phone sitting somewhere with Tasker and a lot of programing to do even Google Home still requires the phone so this is amazing to finally have just work as part of the assistant. Keep up the great work and hopefully Chevy and OnStar will allow location linking soon and that can be added.
B079TYHCYX,myChevrolet,Connected Car,joseph,2.0 out of 5 stars,ditch the pin,"Reviewed in the United States on October 27, 2019",i hate having to give out my pin just to start the car. can we get rid of the pin
B079TYHCYX,myChevrolet,Connected Car,Anthony J. Frabotta,3.0 out of 5 stars,works but lacking commands,"Reviewed in the United States on January 30, 2021",app isgreat for simple commands but wouldlike to see ability to check mybattery charge on my bolt without going using my phone.
B079TYHCYX,myChevrolet,Connected Car,Phunk King,3.0 out of 5 stars,"Works, but missing features for electric vehicles","Reviewed in the United States on October 7, 2018","Having a Bolt EV I was hoping I would be able to ask for a battery status update, or start/stop charging. Turning on/off more granular settings like 8 amps vs 12 amps, hill top reserve, or tire pressie would be awesome but I wasn't expecting them. I was very surprised the higher level functions didn't work seeing as that detail is all in the MyChevrolet app itself."
B079TYHCYX,myChevrolet,Connected Car,Amazon Customer,5.0 out of 5 stars,worked perfect first try,"Reviewed in the United States on August 14, 2020","so I did not even know I had this feature on my onstar hooked it to my alexa effortlessly, asked her to start my car she asked for my pin and wala my car started this will definitely be a plus as i normally have to get my phone and use app while getting ready for work or my key fob and twice since it only runs for supposed to 15 minutes but in reality its more like 10, the only downfall is, that I do not want my family knowing my pin number thats the ehole idea behind a pin to lock your account this needs a voice recognition attached to it so alexa only opens to your voice or pin that way i am not required to enter and give away my pin but anyone else trying to get in my car will have to have my pin please consider this."
B079TYHCYX,myChevrolet,Connected Car,Josh,5.0 out of 5 stars,Great skill,"Reviewed in the United States on August 12, 2018","Works fine for me. Unlocks my truck, locks it, and turns it on and off."
B079TYHCYX,myChevrolet,Connected Car,urafastone,3.0 out of 5 stars,useful but needs work.,"Reviewed in the United States on March 6, 2019","Like others have said, this app is useful to control your vehicle, however, it could be more user friendly.  I have noticed if you ask to start my car, sometimes alexa goes through all options to control the vehicle.  I also wish you could rename “car”.  I do like being able to start the vehicle withiut getting the keys.  hopefully these peoblems will be addressed and then 5 stars will be given!"
B079TYHCYX,myChevrolet,Connected Car,Noone,2.0 out of 5 stars,pin Announce is bad,"Reviewed in the United States on August 12, 2020","Should not need a pin to lock cars, unlock sure but remote start in lock vehicle should not need the pin"
B079TYHCYX,myChevrolet,Connected Car,Amazon Customer,3.0 out of 5 stars,works about 50% of thr time,"Reviewed in the United States on January 17, 2022",they need to impeove it
B079TYHCYX,myChevrolet,Connected Car,J. Seth,5.0 out of 5 stars,"It works now, IT department got in it!","Reviewed in the United States on December 14, 2021",It took one email to GM and their IT guys fixed the glitch and now you can link your account! It works perfectly now!
B079TYHCYX,myChevrolet,Connected Car,Joseph Doucette,3.0 out of 5 stars,Could be more useful,"Reviewed in the United States on April 21, 2019",I would like to see option to open trunk. Also fuel level and read of tire preasure information would be nice.
B079TYHCYX,myChevrolet,Connected Car,A Lowther,5.0 out of 5 stars,So nice,"Reviewed in the United States on November 28, 2018",Helpful! Love it
B079TYHCYX,myChevrolet,Connected Car,Jacob,1.0 out of 5 stars,awkward,"Reviewed in the United States on October 10, 2020",can’t just say alexa start my car. or alexa lock my car. wish it wasn’t a hassel to use. :(
B079TYHCYX,myChevrolet,Connected Car,Mike B.,2.0 out of 5 stars,Starts wrong car,"Reviewed in the United States on February 25, 2019","Asked Alexa to start my GMC Acadia which was parked outside. Alexa started  my XT5 which was parked in the garage, Very dangerous error."
B079TYHCYX,myChevrolet,Connected Car,K.V.,1.0 out of 5 stars,Doesn't work,"Reviewed in the United States on February 10, 2020","My 2018 Ford works great using the Ford skill, 2019 Chevy won't start the car.  Ugh"
B079TYHCYX,myChevrolet,Connected Car,Edward May,5.0 out of 5 stars,Love this app,"Reviewed in the United States on August 4, 2020",Great for starting my car on hot or cold
B079TYHCYX,myChevrolet,Connected Car,Derek Adams,2.0 out of 5 stars,No range info for Bolt EV?,"Reviewed in the United States on March 13, 2021","i have a Bolt EV and it would be really useful to be able to have Alexa tell me the current range or if the vehicle is currently charging. This info is available in the mobile chevrolet app and alexa can say the fuel level in gasoline cars, so why is the information not available on alexa for the Bolt?"
B079TYHCYX,myChevrolet,Connected Car,Danielle E Cooper,1.0 out of 5 stars,stopped working,"Reviewed in the United States on January 20, 2020",worked until a few weeks ago and then stopped. now repeatedly tells me my username and password are wrong
B079TYHCYX,myChevrolet,Connected Car,Dave S.,1.0 out of 5 stars,Why do I have to say my PIN?,"Reviewed in the United States on July 25, 2019",please allow the pin to be saved in the application as stating my PIN verbally is quite annoying if there are guests in the house.
B079TYHCYX,myChevrolet,Connected Car,M. NICOLAS,2.0 out of 5 stars,PIN Code Option,"Reviewed in the United States on December 10, 2019","I would like the option to disable the pin code or have the skill remember my pin code.  My Key fob sits right next to my Alexa, and can remote start and unlock my car without any pin code.  The added step of having to stop and wait and then provide a pin code means that it’s easier and takes less time to walk into the other room pick up my key fob and remote start my car. This Alexa skill should make it easier to start my car not more complicated."
B079TYHCYX,myChevrolet,Connected Car,Miriam,1.0 out of 5 stars,no good,"Reviewed in the United States on January 13, 2021",is it me or someone else is having this problem... Does not recognize my onstar log in info.. No misspells of incorrect password.... needs fix ASAP
