skillid,skillname,category,reviewer,star,title,date,content
B074PDF3ZY,AnyList,Shopping,Maicokid,5.0 out of 5 stars,Grade how it works regardless with alexa not because it's not Android.,"Reviewed in the United States on October 7, 2017",Reasonable request for Android but  not a reason to give it a 1 star.  Idea of stating a certain list is a good idea but what are Alexa limitations to do that before criticizing the app.  This is a very good app and integrated well within the limitations of Alexa.  Recipes portion is also excellent.  Worth the price.
B074PDF3ZY,AnyList,Shopping,Laurie J Hassan,3.0 out of 5 stars,add recipe view,"Reviewed in the United States on June 9, 2020",this is a key feature that is missing!
B074PDF3ZY,AnyList,Shopping,Brian in Boston,5.0 out of 5 stars,Love it. I’d have an Alexa just for this skill.,"Reviewed in the United States on February 22, 2020","Now when I’m working in the kitchen all I have to do is tell Alexa to add something to my grocery list. It syncs with my phone, and everyone’s phone in the family. The basic version is free and that works fine for me. Absolutely nails one of life’s little task. So rare in technology."
B074PDF3ZY,AnyList,Shopping,Amazon Customer,4.0 out of 5 stars,Nice companion to the app,"Reviewed in the United States on November 6, 2020","Had issues that seemed to require a re-sync to resolve, apart form that, it seems to work as described. Handy because I never have my phone nearby when I need to add something to my shopping list. I would like rhe ability to rename the list, but not a must-have."
B074PDF3ZY,AnyList,Shopping,Humberto Degenaro,5.0 out of 5 stars,Perfect!,"Reviewed in the United States on April 25, 2021","I was using app Any.do and it stopes sincronize the list of grocery without any explanation, so now I am using this app."
B074PDF3ZY,AnyList,Shopping,ndoyle07,3.0 out of 5 stars,Great start some needed improvements to make it 5 stars,"Reviewed in the United States on September 21, 2017","I agree with many of the comments for improvement on here but the one not mentioned would be the ability to un-cross off items already on the shopping list, since I use one shopping list and will manually un-cross off items that we need when making the list for the next grocery visit. So if you could say, ""Alexa, uncheck/un-cross off 'food item(s)' from my shopping list"", then you could re-use the list each time to show only the items you need."
B074PDF3ZY,AnyList,Shopping,S. Martin,5.0 out of 5 stars,This skill is the one we use the most,"Reviewed in the United States on June 2, 2018",I use this skill at least 5 times a day. Everyone in our family loves being able to add things to all of our lists the minute something occurs to us. We have 27 AnyList lists and they're all Alexa enabled. This skill alone makes it worth having our Echo. I'm so thrilled the two are integrated. It works flawlessly!
B074PDF3ZY,AnyList,Shopping,Kboeckman,5.0 out of 5 stars,Super useful!,"Reviewed in the United States on September 1, 2017","I've loved this app on my phone for a long time, and the Alexa integration takes it to the next level. Awesome!!!"
B074PDF3ZY,AnyList,Shopping,Matthew S. Anderson,3.0 out of 5 stars,Quick but not custom,"Reviewed in the United States on September 1, 2017","Works well, but the IFTTT tweak allowed me to say which list to add the item to. This skill only uses ""shopping list"""
B074PDF3ZY,AnyList,Shopping,Ivonne,1.0 out of 5 stars,no longer connects to echo show,"Reviewed in the United States on September 10, 2020","i had no problem for the longest time until recently, no longer connects to the echo show. i hope they fix the bug soon. i have tried everything including restarting my phone and unplugging my alexa device."
B074PDF3ZY,AnyList,Shopping,Joseph Nicholes,5.0 out of 5 stars,"Useful, accurate and painless","Reviewed in the United States on April 22, 2018","Does exactly what I need, Creates a grocery checklist on my iPhone which I can reference while shopping at the store.  Painless, accurate Alexa input Is accurately translate to my list including the bonus of categorizing items in groups.  Very nice app.  Looking forward to testing with other types of lists"
B074PDF3ZY,AnyList,Shopping,M. Johnson,2.0 out of 5 stars,expensive,"Reviewed in the United States on November 15, 2020",basic is just like all the others. It is very expensive to upgrade.
B074PDF3ZY,AnyList,Shopping,Kory R,2.0 out of 5 stars,Can’t Access Anylist with Alexa,"Reviewed in the United States on January 23, 2020","I can’t figure out how to get Alexa to recognize this shopping list instead of the built in shopping list in the Alexa app, which also apparently cannot be deleted."
B074PDF3ZY,AnyList,Shopping,Doug Cook,5.0 out of 5 stars,Most used skill...,"Reviewed in the United States on December 23, 2020",This is our most-used skill and we love it.
B074PDF3ZY,AnyList,Shopping,Judith Schonheiter,5.0 out of 5 stars,Works Great,"Reviewed in the United States on November 2, 2017",It's amazing! We tell Alexa to add something to a list and she does (just make sure to get the list name correct). Love it!
B074PDF3ZY,AnyList,Shopping,J. Lee,5.0 out of 5 stars,Perfect for families,"Reviewed in the United States on January 2, 2018","Love love love it. I’ve been an AnyList user for years and just now noticed the Alexa skill. I noticed my aluminum foil was low and just asked Alexa to add it to my grocery list, and there it is. I love that you can make any of your lists be Alexa synced. I love that you can manage the 2 Alexa lists from the AnyList app. I love that my family can now, instead of asking me to remember to get something, just ask Alexa to add it to the list. I often ask them to add it to the app themselves but that extra effort just meant it never got on the list. This is a dream and definitely worth it if you are an AnyList user, and if you’re thinking about starting with AnyList, I recommend you try it. Their base account is free and includes the Alexa skill. Just try it!"
B074PDF3ZY,AnyList,Shopping,Susan C,5.0 out of 5 stars,A Great Marriage,"Reviewed in the United States on October 28, 2017",Two of the best! Alexa and AnyList are both awesome and work awesome together!
B074PDF3ZY,AnyList,Shopping,Zelda Markowicz,5.0 out of 5 stars,Thank goodness,"Reviewed in the United States on January 30, 2018",Finally an Application that provides a much needed service. Me and th pe Hubster Love it.
B074PDF3ZY,AnyList,Shopping,Do All Crafts,1.0 out of 5 stars,sucks,"Reviewed in the United States on December 26, 2019",doesnt add to list on mobile
B074PDF3ZY,AnyList,Shopping,William C. Zoller,5.0 out of 5 stars,Superb app....,"Reviewed in the United States on August 31, 2017","The guys at AnyList must never sleep, because they continue to add useful things to an already great app.  Having AnyList on my Apple Watch is incredibly convenient....  Keep up the good work, guys!"
B074PDF3ZY,AnyList,Shopping,Katianna B.,2.0 out of 5 stars,Needs Recipe and Meal Planning Feature,"Reviewed in the United States on December 27, 2020","We use this app for grocery, recipe and meal planning. but the recipes and meal plans are not available for the Alexa."
B074PDF3ZY,AnyList,Shopping,Aaron,3.0 out of 5 stars,Needs more detail,"Reviewed in the United States on September 13, 2017","I love the fact that there is integration. But it needs to utilize the other fields that are available like quantity. If I want 4 apples it adds the text Four Apples to my list rather than Apples with a quantity of 4. Plus it would be nice to be able to use any of my custom lists, which it cannot."
B074PDF3ZY,AnyList,Shopping,Matt DeLorenzo,5.0 out of 5 stars,Great feature,"Reviewed in the United States on September 11, 2017",This is a great feature and we LOVE it!  Use it daily and it helps organize your list and never forgot those hard to remember items.  Love it!!!
B074PDF3ZY,AnyList,Shopping,Vblizard8756,5.0 out of 5 stars,Awesome skill,"Reviewed in the United States on September 12, 2017","I am so happy there is finally a skill to link to AnyList! While you can't use your own lists, I don't find it difficult to switch the list I use for my grocery shopping to the Alexa shopping list instead of mine."
B074PDF3ZY,AnyList,Shopping,Karen G,5.0 out of 5 stars,Five Stars,"Reviewed in the United States on October 30, 2017",you can now use it with your existing list names.  Thank you!
B074PDF3ZY,AnyList,Shopping,Chuck Bryant,5.0 out of 5 stars,Seamless and delightful,"Reviewed in the United States on October 30, 2017",Adds items to your linked AnyList lists just as you would expect. Quick and reliable.
B074PDF3ZY,AnyList,Shopping,Dave,4.0 out of 5 stars,Fant,"Reviewed in the United States on September 16, 2017",Works great! Like other just wish I could use existing lists...but this is fantastic!
B074PDF3ZY,AnyList,Shopping,Maryland Mom,5.0 out of 5 stars,best app for family,"Reviewed in the United States on April 20, 2021",Keeps a shopping list up-to-date for everyone to tap into
B074PDF3ZY,AnyList,Shopping,Argocat,4.0 out of 5 stars,Alexa in the kitchen!,"Reviewed in the United States on September 11, 2017","So handy!  I use Alexa for cooking and timers. Now I also have Alexa add items to my AnyList grocery list on my phone hands-free.  Add my AnyList recipes to Echo Show, and I’ll change my rating to a 5!"
B074PDF3ZY,AnyList,Shopping,J. Book,5.0 out of 5 stars,Free version is great!,"Reviewed in the United States on December 27, 2017","This app is awesome!  Even the free version does everything I wanted, especially sorting lists and sorting categories.  In minutes I had created an account, synced with my existing Alexa shopping list, and sorted categories to match my grocery store layout. Perfect!"
B074PDF3ZY,AnyList,Shopping,DocSmith,2.0 out of 5 stars,Not working on iphon,"Reviewed in the United States on February 17, 2018",I loved this app but it has stopped working on my iPhone. Alexa says she's added the item to the list but the list is blank.
B074PDF3ZY,AnyList,Shopping,Merlin,1.0 out of 5 stars,Skill is NOT ready for Prime Time.,"Reviewed in the United States on September 12, 2017","Not Ready for Prime Time.You CAN'T direct which list to add the item to.Alexa responds that the item has been added, but my account has 6 listsAnd the items NEVER appear in the desired list - the one shared by my wife and meSo - - until the developers FIX THIS - - it'll NOT find use in our household"
B074PDF3ZY,AnyList,Shopping,Andy P,1.0 out of 5 stars,I REALLY do not want it to do anything with the Alexa Shopping or ToDo List,"Reviewed in the United States on September 11, 2017","There are already plenty of ways to sync my Anylist to the Alexa Shopping list.  Plenty of IFTTT skills to pull that off.  I want direct access to shopping lists completely bypassing the Amazon stuff.  I should be able to say ""Alexa, tell AnyList to add toilet paper to my Grocery Store shopping list."" and ""Alexa, tell AnyList to add underwear to my Walmart shopping list."""
B074PDF3ZY,AnyList,Shopping,Dwayne Springfield,2.0 out of 5 stars,no recipe integration,"Reviewed in the United States on June 30, 2020",without integration to the recipes this is half a skill.
B074PDF3ZY,AnyList,Shopping,Desert Gal,3.0 out of 5 stars,Settings keep changing,"Reviewed in the United States on December 2, 2020",Yesterday I spoke to a tech support guy and told him my lists had changed.  It used to add the note I wanted at the top of my list and somehow it changed and old ones show on the top.  He did something and it went back to how it had first been.  I look at it today and somehow it reverted back to showing old notes on top and most recent on bottom.  I really like my Echo Dot but this is quite annoying.
B074PDF3ZY,AnyList,Shopping,foursixquebec,5.0 out of 5 stars,Love this app & Alexa makes it even easier,"Reviewed in the United States on August 19, 2018","Thank you for a great app!  I have multiple different lisfs that j’ve given Alexa access to (you have to enable Alexa’s access to each list you want her to add from), so I just tell her to add whatever to my Costco list or my grocery list or my Target list.  Love the convenience of adding things with Alexa when my hands are full or I’m in the middle of something else."
B074PDF3ZY,AnyList,Shopping,Wendy541,5.0 out of 5 stars,Works great!,"Reviewed in the United States on December 1, 2017",Works great! Adds products to my list immediately with no issues.Thank you for making my life easier.
B074PDF3ZY,AnyList,Shopping,Manuel Cancel,1.0 out of 5 stars,not working on my amazon echo show,"Reviewed in the United States on December 28, 2020",i cant get my shopping list on my amazon wcho show now. i tried to reset back to factory settings and still not working
B074PDF3ZY,AnyList,Shopping,Amazon Customer,1.0 out of 5 stars,20 swap contact list doesn't work at all,"Reviewed in the United States on February 11, 2022",how can I call others on my home alexa
B074PDF3ZY,AnyList,Shopping,Joel Byford,4.0 out of 5 stars,Worth Every Penny,"Reviewed in the United States on February 1, 2018","Took some debugging, but for it working for both my wife and I sharing a grocery and Costco list. We don’t even use paper anymore and with the Apple Watch can even skip the phone.  May be a touch expensive compared to other apps so -1 Star for the price. Still best app available."
B074PDF3ZY,AnyList,Shopping,J car,1.0 out of 5 stars,No good,"Reviewed in the United States on August 7, 2018",Worst then it was before this update. You don't have any choice. You have item called completed list you take an item off. It throws it over to the incomplete list.  Only thing good for this apply is if you have full hands and cannot write something down.
B074PDF3ZY,AnyList,Shopping,Emily Zarr,5.0 out of 5 stars,Love this!! Works perfectly!!,"Reviewed in the United States on September 12, 2017",I enabled the skill and it worked perfectly!!! Awesome!!!
B074PDF3ZY,AnyList,Shopping,Dala,1.0 out of 5 stars,Doesn't work reliably,"Reviewed in the United States on May 5, 2018","Anylist and Echo user for years, been using kludgy IFTTT integration to get from Alexa > IFTTT > iOS reminders > Anylist.Attempted to use Anylist skill to accomplish the same thing, and it doesn't work. Added three separate items to shopping list, 15 minutes later, one item has appeared, other two items are not there."
B074PDF3ZY,AnyList,Shopping,M Lindsay,5.0 out of 5 stars,Live,"Reviewed in the United States on February 6, 2018",No excuses now to not get something on the shopping list.
B074PDF3ZY,AnyList,Shopping,TDoyle,5.0 out of 5 stars,"AnyList is one of my favorite apps, even more helpful with Alexa","Reviewed in the United States on September 17, 2017","This is by far one of the most productive apps I use and now that it's integrated into Alexa, it's even more useful. They've done a great job on making something as simple as a list/recipe app superb."
B074PDF3ZY,AnyList,Shopping,Theresa L. Williamson,5.0 out of 5 stars,Love this!,"Reviewed in the United States on October 16, 2017",I love being able to build my lists as I think about it
B074PDF3ZY,AnyList,Shopping,Annie,5.0 out of 5 stars,Works,"Reviewed in the United States on December 22, 2019",Works Flawless
B074PDF3ZY,AnyList,Shopping,veba,5.0 out of 5 stars,Works like a champ - instant updates on my echo and vice versa,"Reviewed in the United States on September 12, 2017","Alexa app is slower compared to this app - it has auto complete which makes things much easier. I can check off items in the store, added by my wife at home through alexa.I wish we have custom lists and auto suggest to create new list based on the items in my list."
B074PDF3ZY,AnyList,Shopping,T. Donnelly,2.0 out of 5 stars,I want to add to MY list,"Reviewed in the United States on September 11, 2017",Does me little good to add to a separate Alexa list. I need to add to the shopping list I normally use.
B074PDF3ZY,AnyList,Shopping,Ladibuc,5.0 out of 5 stars,as a long term AnyList user i love this app!,"Reviewed in the United States on October 16, 2020",as a long term AnyList user i love this app!
B074PDF3ZY,AnyList,Shopping,Matthew,5.0 out of 5 stars,Great skill,"Reviewed in the United States on September 4, 2017","I've had this functionality for a long time with an IFTTT recipe, but a native skill is so much better. Few things I wish could be different like being able to rename the list, but those are small issues and they are more about what Amazon allows and doesn't. These guys put a lot of work into the skill and it shows."
B074PDF3ZY,AnyList,Shopping,Joey,5.0 out of 5 stars,Works!,"Reviewed in the United States on January 26, 2022",To fix your items going to Alexa lists you just open AnyList settings / Amazon Alexa and remove check marks on Alexa lists and add check marks to your AnyList lists.  Done!  Works great!
B074PDF3ZY,AnyList,Shopping,The Pierces,1.0 out of 5 stars,Stopped working with Anylist skill,"Reviewed in the United States on May 16, 2018",Doesn’t add items to Anylist. Only adds to Alexa lists.
B074PDF3ZY,AnyList,Shopping,Amazon Customer,4.0 out of 5 stars,This skill is a great start! It would be even more useful if ...,"Reviewed in the United States on December 26, 2017",This skill is a great start! It would be even more useful if AnyList worked with the Amazon Echo Show to display recipes.
B074PDF3ZY,AnyList,Shopping,Kimberly A.,1.0 out of 5 stars,Stopped working,"Reviewed in the United States on September 28, 2020",was great while it worked (over 2 years for me) - stopped working a few weeks ago.
B074PDF3ZY,AnyList,Shopping,Candace C.,5.0 out of 5 stars,Five Stars,"Reviewed in the United States on September 13, 2017",Love it!
B074PDF3ZY,AnyList,Shopping,Jason,5.0 out of 5 stars,Use it every day,"Reviewed in the United States on April 4, 2018",AnyList is the best app available for simple lists. We use it daily for groceries. The Alexa integration works well and makes adding to our multiple lists seamless. Thanks AnyList!
B074PDF3ZY,AnyList,Shopping,Grady Gray,5.0 out of 5 stars,List,"Reviewed in the United States on October 23, 2017","Well, took disabling and enabling it again, but it works great now!! Love it!!!"
B074PDF3ZY,AnyList,Shopping,Jeff S,5.0 out of 5 stars,AnyList changed my life,"Reviewed in the United States on December 20, 2017","Had a stroke in early 2017.  AnyList was the answer.  Lists work across my iPhone, iPads, Mac Pro, imac, etc.  The Recipe function is fantastic if you cook a lot like I do, esp the browser/import function.  Thumbs way up!"
B074PDF3ZY,AnyList,Shopping,Anna J.,3.0 out of 5 stars,Doesn't use own lists!!!?,"Reviewed in the United States on September 13, 2017","This app works much faster and is more organized than the lists in Alexa. However, you can't use your own lists  I.e., Target, or Trader Joe's, or music to buy. #SAD"
B074PDF3ZY,AnyList,Shopping,chip loomis,5.0 out of 5 stars,Great app,"Reviewed in the United States on March 31, 2018",Makes our day
B074PDF3ZY,AnyList,Shopping,Trendy,1.0 out of 5 stars,Waste of time,"Reviewed in the United States on March 18, 2018",I can't even setup a login.
B074PDF3ZY,AnyList,Shopping,April Amey,5.0 out of 5 stars,Use this all the time,"Reviewed in the United States on December 4, 2017",I was so happy when I realized this was an Alexa skill
B074PDF3ZY,AnyList,Shopping,Alex,3.0 out of 5 stars,Skill does not support my preferred language.,"Reviewed in the United States on August 11, 2020",It is not possible to configure the Português/BR language.
B074PDF3ZY,AnyList,Shopping,M. Van Winkle,5.0 out of 5 stars,Great assist for any home!,"Reviewed in the United States on March 7, 2018",Very helpful
B074PDF3ZY,AnyList,Shopping,Amazon Customer,5.0 out of 5 stars,Great start - thank you,"Reviewed in the United States on September 17, 2017","I love the AnyList app, especially for groceries and shopping items. Great start with this new skill, looking forward for tighter Integration to access all my lists."
B074PDF3ZY,AnyList,Shopping,Allen,1.0 out of 5 stars,No luck,"Reviewed in the United States on August 7, 2018","I have tried for a few days now, 20-40 minutes at a time to get this set up and have followed the directions to a “T” with no luck. Guess I’ll try a different Skill and app."
B074PDF3ZY,AnyList,Shopping,Review Girl,3.0 out of 5 stars,you can add to lists,"Reviewed in the United States on February 24, 2020","but, you have to specifically, “Alexa, add carrots (as an example) to my grocery (another example of a list) on Any List.” Otherwise, it will create a new Alexa grocery list which is not visible on the phone app, so its useless when youre at the store."
B074PDF3ZY,AnyList,Shopping,Jennie Leigh,2.0 out of 5 stars,Need Recipe Access,"Reviewed in the United States on November 27, 2017","AnyList is my new favorite list & recipe app. It provides almost all the functionality I could ask for. My only issue is that its connection with Echo offers no access to the recipes. This would be extremely helpful, particularly with the capabilities of the Echo Show. I'd give it five stars if I could use it as a cookbook on the Echo Show as well as a list keeper."
B074PDF3ZY,AnyList,Shopping,Janice Strahan,2.0 out of 5 stars,Shopp,"Reviewed in the United States on February 17, 2018",Alexa has stopped working on my IPhone.  I can no longer bring up my shopping list.
B074PDF3ZY,AnyList,Shopping,Ed & Deb Romaine,1.0 out of 5 stars,anylist recipes dont wotk with echo display,"Reviewed in the United States on January 25, 2020",doesnt work to display anylist recipes?? i bought this for my wife for this functionality. Not happy!!
B074PDF3ZY,AnyList,Shopping,Ash,5.0 out of 5 stars,AnyList has arrived on Alexa!,"Reviewed in the United States on December 14, 2017","I've been using this on my iPhone for years, and was excited to see it come to Alexa... it integrates perfectly as a shopping list with seamless cross platform integration."
B074PDF3ZY,AnyList,Shopping,ACady,5.0 out of 5 stars,Alexa is finally WORKING!!,"Reviewed in the United States on October 12, 2020","yay! I absolutely love this skill. A while there it wasn’t working. So I had to disable and enable it a couple of times. Finally, did it again today and it started working! Super excited to be able to use this skill again, Because it is so useful.￼"
B074PDF3ZY,AnyList,Shopping,Amazon Customer,2.0 out of 5 stars,play list,"Reviewed in the United States on February 24, 2019",it is difficult to get my play list to play
B074PDF3ZY,AnyList,Shopping,Gina G.,1.0 out of 5 stars,No help,"Reviewed in the United States on August 4, 2018","I followed the directions and it still won’t link with Alexa. When I tried to “submit help,” the gray “submit“ button stayed grayed out,"
B074PDF3ZY,AnyList,Shopping,kellye,1.0 out of 5 stars,cant see recipes? ugh!,"Reviewed in the United States on January 28, 2020",the only feature i truly care about is the ability to see my recipes!  please please please add this functionality!
B074PDF3ZY,AnyList,Shopping,HopeM,5.0 out of 5 stars,Works Great,"Reviewed in the United States on December 11, 2017",I really enjoy this skill. No compla
B074PDF3ZY,AnyList,Shopping,Amazon Customer,1.0 out of 5 stars,amazon alexa will mot open in grocery store,"Reviewed in the United States on December 5, 2020",i can not open the app in grocery store to see my lists
B074PDF3ZY,AnyList,Shopping,Kaelic,5.0 out of 5 stars,GREAT!!!!,"Reviewed in the United States on September 17, 2017",GREAT!!!!
B074PDF3ZY,AnyList,Shopping,Kindle Customer,3.0 out of 5 stars,How do I empty my list?,"Reviewed in the United States on March 9, 2018",Can't figure out HOW.
B074PDF3ZY,AnyList,Shopping,Jason,4.0 out of 5 stars,great for adding to Grocery list,"Reviewed in the United States on November 3, 2020","One of my most used skills. Use it almost every day to update our grocery list. Just bought an Alexa Show, would like the ability to view my recipes and meal planning calendar while cooking in the kitchen."
B074PDF3ZY,AnyList,Shopping,M. Manza,5.0 out of 5 stars,Fantastic integration between Alexa and the AnyList app,"Reviewed in the United States on September 16, 2017","This makes managing a shopping list a real breeze since you get all the benefits of using voice to add and adjust the shopping list via Alexa along with all the benefits of grouping of items, sharing of the list and easy access once in the store."
B074PDF3ZY,AnyList,Shopping,Dr. Mac,3.0 out of 5 stars,'Twould be great if as advertu,"Reviewed in the United States on October 25, 2017","We love both Alexa and AnyList. I was disappointed in the beta version of this skill because we couldn’t use our established lists. Not, she says she did it,  it the item doesn’t appear there. However, when I create a ""test list"", it seems to work. Names like ""shared shopping list"", "" my grocery list"", ""groceries"". Don’t seem to work for me."
B074PDF3ZY,AnyList,Shopping,Gigi Sings,2.0 out of 5 stars,doesn't work as expected,"Reviewed in the United States on January 19, 2021","i like it, except if i use Alexa or Google to add items because it automatically crosses the items off the list.the developers fix was to unlink it to Alexa and Google.I'll really like it if it works the way it's supposed to."
B074PDF3ZY,AnyList,Shopping,Julia,5.0 out of 5 stars,great,"Reviewed in the United States on January 20, 2021",it helps me know what i need to get from the grocery store great app
B074PDF3ZY,AnyList,Shopping,Greg,2.0 out of 5 stars,Need More Flexibili,"Reviewed in the United States on September 13, 2017","I'm glad that AnyList works with Alexa, however like many others have said, I need the ability to add to a specific list. I have no use for this skill as it is now."
